title,Date
What are some responses toward BTC you have received when talking to someone who knows little about it? How did you try to explain in layman's terms?,12/16/2013
How do I get more DOGE?,12/16/2013
Wow. Purchased ShibeBay.com. What would fellow Doges like to see on there?,12/16/2013
Crypto Currencies are the future but maybe not bitcoin?,12/16/2013
Join the Cryptocurrency Investment Club and receive a lifetime free subscription - they will soon start taking payments!,12/16/2013
Destroy my idea - Charitable CryptoCurrency,12/16/2013
Is there a CryptoCurrency just for non-profits/charities? (X-post - /r/CryptoCurrency),12/16/2013
Battle Aids/Hiv with bitcoin and other cryptocurrency!,12/16/2013
"So printer, much profit.",12/16/2013
Anybody here know about Cryptocurrency?,12/16/2013
Bitcoin is so 2013: Dogecoin is new cryptocurrency on the block,12/16/2013
Bitcoin is so 2013: Dogecoin is new cryptocurrency on the block,12/16/2013
"Fear of regulation.. banning of bitcoin/altcoins THEN governments issuing their own ""legal"" cryptocurrency, wallets and exchanges.",12/14/2013
"What's your opinion of Dogecoin, an alternate cryptocurrency much like Litecoin?",12/14/2013
Selling Bitdefender Total Security 1 Year Licence for Bitcoins/ Litecoins/ Feathercoin,12/14/2013
I created MyAltCoins to track all your cryptocurrency assets (100% free),12/14/2013
1M COINS 530$ eBay bid!,12/14/2013
The Cryptocurrency Revolution &amp; Black People,12/14/2013
The Cryptocurrency Revolution &amp; Black People,12/14/2013
The Cryptocurrency Revolution &amp; Black People,12/14/2013
[ANN] CryptoCurrency Services,12/14/2013
Austin Bitcoin/Cryptocurrency Meetup [7:00pm December 15 Scholz Garten],12/14/2013
Can you dig using your wallet?,12/14/2013
[WTS]1 MILLION DOGECOINS,12/14/2013
"Bitcoin As A Medium Of Exchange: Domestic Remittances Use Case - Cryptocurrency News, Bitcoin Trading Analysis",12/14/2013
Buy reddit gold with Dogecoin.,12/14/2013
/r/dogecoin Wow. Such cryptocurrency. Much wealth. Many doge. Overtake bitcoins. To the moon.,12/14/2013
Calling all online dogewallets,12/14/2013
[X-POST] I created MyAltCoins to track all your cryptocurrency assets (100% free),12/14/2013
CONCEPT: laissez faire P2P marketplace,12/15/2013
"Long term vs short term (or, Holding vs Trading).",12/15/2013
"My next check has ~$250 available after bills and I want my 1st cryptocurrency sooooo much. Should I buy eBay mining contracts or just get a $260 laptop with 1Gb dedicated video(I currently have no PC, an want one)? Which video cards are better for mining vs gaming? Thanks!",12/15/2013
CONCEPT: laissez faire P2P marketplace,12/15/2013
"A reddit user is trying to delete the wikipedia article of DogeCoin because he dislikes cryptocurrency, proof",12/15/2013
"[WTB]Buying 500k dogecoin, $150 PAYPAL",12/15/2013
Start Up CryptoCurrency Exhange Site Comparison,12/15/2013
The Big Move,12/15/2013
What is the best way to PURCHASE dogecoin as someone who doesn't currently own any cryptocurrency,12/15/2013
"I've always been fascinated by cryptocurrency (or whatever BitCoin and DogeCoin is), but have never understood how to acquire some. Help a n00b?",12/15/2013
Bitcoin the Cryptocurrency (Parody of Rudolph the Red-Nosed Reindeer),12/15/2013
Is there a cryptocurrency mining tied to natural resource production?,12/15/2013
[X-POST] I created MyAltCoins to track all your cryptocurrency assets,12/13/2013
"If you support Bitcoin, you should support Litecoin.",12/13/2013
[X-POST] I created MyAltCoins to track all your cryptocurrency assets (100% free),12/13/2013
DGC vs WDC,12/13/2013
"With the recent boom in Bitcoin media/government awareness, what would the most likely reason Bitcoin would fail and which altcoin is most likely to be its successor?",12/13/2013
A cool website that lists all my Cryptocurrency addresses in one place,12/13/2013
A cool website that lists all my cryptocurrency addresses in one place,12/13/2013
Dogecoin is my first cryptocurrency,12/13/2013
A cool website that lists all my cryptocurrency addresses in one place,12/13/2013
Bitcoin Cryptocurrency Crash Course with Andreas Antonopoulos (suitable for non-geeks),12/13/2013
"A conversation with my old man on this ""drug money""- how many others have had such conversations with their family/friends and in what ways am I mistaken or missing good points/opportunities?",12/13/2013
"From a pure cryptocurrency standpoint, after reading these few paragraphs about the logic behind the 21M limit, should I not trust any other coin that features a higher coin limit?",12/14/2013
Different kind of Wallets,12/14/2013
One things that disgusts me about BTC community.,12/14/2013
The unofficial Bitcoin/Cryptocurrency rap anthem comin atcha,12/14/2013
I made an HN for the Cryptocurrency community!,12/14/2013
TIL the pope now allows atheists to tithe with cryptocurrency [x-post from /r/shutupandtakemybitcoin],12/14/2013
"Dogecoin, such cryptocurrency, wow",12/14/2013
Money Laundering Thought,12/14/2013
One million doge on ebay going for $346,12/14/2013
Cointrepreneur - A new word to describe cryptocurrency entrepreneurs?,12/14/2013
Mining botnets?,12/12/2013
Can I crossfire a Dell Pegatron HD670 with a VisionTek AMD Radeon HD 7850?,12/12/2013
The day I started mining.,12/12/2013
letter to matt miller,12/12/2013
"Monkey See, Monkey Do: Or Why There's No F*cking Way You're Getting Rich This Year",12/12/2013
"Monkey See, Monkey Do: Or Why There's No F*cking Way You're Getting Rich This Year",12/12/2013
Why we chose Bitvid - and why it works.,12/12/2013
Glass Invite for Bitcoin or Litecoin?,12/12/2013
"I'd love to take a trip to Cyprus, see Neo &amp; Bee, and have a few vacation days to spend some Bitcoin while I'm there. Any suggestions for how to get started?",12/12/2013
[Faucet] Free Faucet -- Multiple Cryptocurrency Faucet,12/13/2013
If a cryptocurrency becomes globally accepted by many it has the potential to be the safest store of wealth imaginable.,12/13/2013
I created MyAltCoins to track all your cryptocurrency assets,12/13/2013
"anoncoin | Cryptocurrency News, Bitcoin Trading Analysis",12/13/2013
Found a hacked server this morning mining for litecoin.,12/13/2013
DAE want graphics cards to be in stock?,12/13/2013
Why Are New Types Of Coins Worth Anything?,12/13/2013
Bitcoin Cryptocurrency Crash Course with Andreas Antonopoulos - Jefferson Club Dinner Meetup,12/13/2013
Litecoin isn't different nor ground breaking. Get over it and lets move forward.,12/13/2013
Bitcoin Cryptocurrency Crash Course with Andreas Antonopoulos,12/13/2013
Is there a risk of JP Morgan somehow interfering with bitcoin given its patent application?,12/11/2013
Android app help?,12/11/2013
Megacoin - Revolutionary CryptoCurrency (New Marketing Video),12/11/2013
"[PARTNER] Seeking developer to enhance Privatecoin, a new altcoin currently in development.",12/11/2013
My first guide on Bitcoin Mining. Feedback welcome.,12/11/2013
Megacoin - Revolutionary CryptoCurrency,12/11/2013
Help convince WIKIPEDIA to accept Bitcoin Donations,12/11/2013
Need advice for new cryptocurrency stock exchange domain name,12/11/2013
"1st BTC/Altcoin Mining Guide, Feedback Welcome!",12/11/2013
Megacoin - Revolutionary CryptoCurrency Teaser (YouTube),12/11/2013
Proof of Stake and Peercoin's Historic Significance,12/11/2013
Homeschool - Ideas for my children,12/11/2013
JPMorgan's Cryptocurrency Challenges Traditional Powers,12/11/2013
Thoughts on Nxt Coin? (100% PoS),12/11/2013
"Austin Bitcoin and CryptoCurrency Meetup 7:00pm Dec 15, Scholz Garten",12/12/2013
Baseball cards to Altcoins - A lesson from recent history,12/12/2013
Give me your best argument that Bitcoin will be the dominant cryptocurrency a year from now.,12/12/2013
Newb question about joining a mining pool!,12/12/2013
Howdy. I'm not very good at this. I don't have any fancy to show you. I don't even have tits. I just have my story.,12/12/2013
"If crypto currency has a weak link, what do you think it is?",12/12/2013
Newb question about joining a mining pool!,12/12/2013
Attempting to distill my thoughts into writing,12/12/2013
"Why KYC and AML are irrelevant, ineffective and potentially even helpful when it comes to Bitcoin. Or, why Altcoins will succeed as a secondary market.",12/12/2013
Idea for a constant-value currency,12/12/2013
"""Buy music with Bitcoin: independent record laber Monstercat accepts cryptocurrency""",12/12/2013
Teenage Bitcoin Entrepreneur,12/12/2013
[PARTNER] Content writers for Bitcoin news site,12/12/2013
"I'm adding another 7950 to my gaming PC for crypto mining, you guys are my best bet.",12/12/2013
"Introducing CryptocoinTicker, a desktop application for Cryptocoin exchanges",12/10/2013
"The BTCUSD bid/ask spread is $122.20. This is insane, and the end of cryptocurrency could be nigh. If it goes, belly-up, I'm gonna buy four super-cheap AMD GPU's and go quad-sli!",12/10/2013
What to do now? Please help.,12/10/2013
"Cryptocoiners, unite!",12/10/2013
"Cryptocoiners, unite! (x-post /r/BitcoinSerious)",12/10/2013
BARKING NEWS! Wow! Dogecoin secures first round of Venture Capital Funding! $$$ + $$$ --&gt; [°. °],12/10/2013
A thought about the future of Bitcoin,12/10/2013
Bitcoin wins space race as the first cryptocurrency to land on The Moon,12/10/2013
Im trying to show the power of cryptocurrency to my homeschooled children.,12/10/2013
I made an HN for the Cryptocurrency community!,12/11/2013
"Behind a Cryptocurrency: How important is Marketing &amp; Branding in the success of a Cryptocoin? -- A case of Quark, ZetaCoin and MegaCoin.",12/11/2013
I made an HN for the Cryptocurrency community!,12/11/2013
Creating publicity for Litecoins!,12/11/2013
Anyone Have Info For Crypto Promoters?,12/11/2013
"Following the Recent ""Apple Hate"" Surrounding the Denial of Bitcoin Related apps from the AppStore",12/11/2013
How to Buy Bitcoins or trade Cryptocurrency Virtual Altcoins Quarks Lite...,12/11/2013
Cryptocurrency and Anonymity For all,12/11/2013
[AMD] Let's discuss.,12/11/2013
Doctor combats Aids/Hiv with cryptocurrency! Helps broaden the use of cryptocurrency in south florida!,12/11/2013
Anyone who decided to mine Quark like I talked about in my old threads should watch the price on the 13th-19th. You may want to sell it.,12/11/2013
"Dogecoin, A Cryptocurrency For Doges, Is Now A Thing",12/11/2013
Bitcoin is technology. Don't compare it to gold or currency.,12/11/2013
Worth setting up a UK based cash-for-litecoins exchange?,12/11/2013
"Does anyone know of, or is using a Litecoin/Bitcoin/Cryptocurrency Ticker for Rainmeter?",12/11/2013
The marketing aspect of cryptocurrency,12/11/2013
"Seeking developer to enhance Privatecoin, a new altcoin currently in development.",12/11/2013
Bitcoin/Altcoin Resource Tool,12/9/2013
Thoughts on coinmkt?,12/9/2013
wow such confuse many noob,12/9/2013
A Guide to What the Heck is Going On,12/9/2013
LTC Raw Historical Data,12/9/2013
What I imagine people think of when I tell them I mine cryptocurrency,12/9/2013
What I imagine people think of when I tell them I mine cryptocurrency (X-post /r/bitcoin),12/9/2013
A better way to solve the Bitcoin - Apple Crisis,12/9/2013
[Idea]Can someone create a graph ?,12/9/2013
Cryptocurrency?,12/9/2013
[Beg] Looking for any kind of assistance to get the cryptocurrency newbies on their way!!!,12/9/2013
"25 yr old - $12/hr, 30 hrs a week; Interested in what I should be saving (And as a side-discussion, whether I'm a fool for not being interested in cryptocurrency)",12/10/2013
"With the world of various cryptocurrencies proliferating so fast, should it be regulated?",12/10/2013
How does borrowing on Bitfinex work?,12/10/2013
A honest advice for people who just started mining or willing to invest into a mining rig,12/10/2013
"Do you enjoy freebitco.in? Check out the litecoin version, ltc4you!",12/10/2013
"Community policy regarding ""sob stories"", scammers and tipping.",12/10/2013
Your Opinion on what I see as Myopia in the Digital Currency phenomenon and how to deal with it.,12/10/2013
"Introducing the Crypto Consortium: An idea, and I'd like your help.",12/10/2013
"[Build Complete] Meet Hobbes and Leviathan, a twin pair of rigs for cryptocurrency mining",12/10/2013
"Building a PC this Christmas, looking for some advice",12/10/2013
"Hey r/bitcoin - Alex Winter here to answer any questions you might have about my new movie ""Deep Web: The Untold Story of Bitcoin and Silk Road."" Would love to hear your thoughts and input over the course of the film's production.",12/10/2013
Idea for enabling BTC-backed alternate cryptocurrencies,12/10/2013
"[WTS] Steam Games, Amazon Gift Cards",12/10/2013
A few questions before I start.,12/10/2013
A good ending as well as a cautionary tale.,12/10/2013
New users: please read out updated and expanded posting guidelines,12/10/2013
New users: please read our updated and expanded posting guidelines,12/10/2013
The problem with Bitcoin (and other crypto-currencies),12/10/2013
LTC to FTC hashrate question.,12/10/2013
"With its own cryptocurrency, Doge has officially conquered 2013",12/10/2013
Do Development Team members of a cryptocurrency get paid? Are they compensated for their work?,12/8/2013
Mining Stablecoin,12/8/2013
I just read the FBI report on Bitcoin security. How does Quark differ?,12/8/2013
Bitcoin as a serious threat to fiat (and everything attached) because of a possible tipping point?,12/8/2013
"DOGECOIN, The Brand New CryptoCurrency, inspired by the greatest meme of all time.",12/8/2013
"BitCoin Brokers, is this the future?",12/8/2013
What are the issues with faster block generations cryptocurrencies? (x-post from r/CryptoCurrency),12/8/2013
Printing money,12/8/2013
"Bitcoin Finally Mentioned in Fox's The Simpsons - Cryptocurrency News, Bitcoin Trading Analysis",12/8/2013
"Hello, I made a comment on a post, I thought it might start a discussion but it didn't, so let's try again.",12/8/2013
Regarding mining and the value of ANY cryptocurrency,12/8/2013
"Cryptocurrency; decrentralized "" .. the integrity and balance of all ledgers is ensured by a decentralized swarm of mutually distrustful parties."" : )",12/8/2013
what do you think is the next big cryptocurrency?,12/8/2013
"How about a new cryptocurrency like Namecoin, only instead of DNS entries it stores gay marriages. LoveCoin FTW!",12/9/2013
RANT: I need to get this off my chest. The state of elitism in cryptocurrency mining (especially LTC) and how fucking infantile it is.,12/9/2013
"Tax for cryptocurrency profit (BTC, LTC, PPC, etc): an idea not yet discussed to minimize obligation",12/9/2013
To those using Cryptsy...,12/9/2013
The Top Arguments Against Bitcoin,12/9/2013
[Positive] u/taylorpreisser - Great transaction for LARGE lot of silver!,12/9/2013
"CryptoNate, a way to donate to your favorite charities and projects with cryptocurrency and Reddit!",12/9/2013
"Feeling generous? Check out CryptoNate, a way to donate to your favorite charities and projects through cryptocurrency and Reddit! ",12/9/2013
Investing in Cryptocurrency,12/9/2013
[AMA Request] Somebody who made a lot of money via Bitcoin/Alternate cryptocurrencies,12/9/2013
Signed up for a mtgox account. It's asking me for a lot of info. what to do? [no upvotes please],12/7/2013
ALTcointip now supports 8 cryptocurrency exchange APIs,12/7/2013
Cryptocurrency is awesome! This is my first milestone,12/7/2013
Good return investment Cryptocurrencies,12/7/2013
"If cryptocurrencies can be infinitely divided by their decimal place, how is that different from printing a limitless amount of money?",12/7/2013
Ton of Wacom Digital Art Tablets. Wacom/Intuos/Bamboo GREAT flip opportunity.,12/7/2013
Never loved my phone more - both LTC and BTC current balances and exchange rates updating once per hour. [Android; MetaWidget] Git source for my server in comments. [x-post from /r/CryptoCurrency],12/7/2013
Never loved my phone more - both LTC and BTC current balances and exchange rates updating once per hour. [Android; MetaWidget] Git source for my server in comments. [x-post from /r/CryptoCurrency],12/7/2013
Is Kaiser shilling it up?,12/7/2013
I want to start mining; what are my options?,12/8/2013
Does popularity of a cryptocurrency ruin it's real-world viability?,12/8/2013
On Cryptopluralism,12/8/2013
"Thought Experiment: ""Your honor, my defense is that a bounty of $2million in bitcoin goes to any judge that sentences me."" What happens next?",12/8/2013
The distortion of BitPay: thoughts on how the growth of BitPay is bootstrapping a bitcoin economy into a world with very different motivations than those of bitcoin enthusiasts,12/8/2013
"Is it worth for me to sell my current gaming rig for a Litecoin mining machine, or wait for the scrypt ASIC miner?",12/8/2013
Everyone interested in and opposed to cryptocurrency should watch/listen to this video.,12/6/2013
Need advice: Is this pre-built rig any good?,12/6/2013
Any advice? Is this set up worth getting?,12/6/2013
"Video: Bitcoin &amp; Cryptocurrency Panel Featuring David Chen (Lightspeed Ventures), Chris Larsen (Ripple.com), Vinny Lingham (Gyft.com), David Johnston (BitAngels.co), J Cabou (Perkins Coie) &amp; Adam B. Levine (Let's Talk Bitcoin!)",12/6/2013
"Just hearing about SRC, would like some help getting started",12/6/2013
How Do I Get Exposure To Cryptocurrency Without Buying A Specific Coin?,12/6/2013
Inside Bitcoins - Conference and Expo for Virtual Currency and Cryptocurrency,12/6/2013
"Scam Scale Rating, auditing proposal",12/6/2013
Crypto currency question,12/6/2013
Why are most of you here rather than in BTC?,12/6/2013
League Against Aids inc. Now accepting cryptocurrency! Help battle Aids/Hiv!,12/6/2013
"List all your public cryptocurrency addresses in one place for easy access, using this website.",12/6/2013
Austin Bitcoin and Cryptocurrency Meetup [7:00 pm Sunday Dec 8 @Scholz Garten 1607 San Jacinto Blvd],12/6/2013
Austin Bitcoin and Cryptocurrency Meetup [7:00 pm Sunday Dec 8 @Scholz Garten 1607 San Jacinto Blvd],12/6/2013
Austin Bitcoin and Cryptocurrency Meetup [7:00 pm Sunday Dec 8 @Scholz Garten 1607 San Jacinto Blvd],12/6/2013
SHA-3?,12/6/2013
Why I will NEVER give up on Bitcoin,12/6/2013
[WTS] Ton of Wacom Digital Art Tablets. Wacom/Intuos/Bamboo GREAT flip opportunity.,12/6/2013
Thought exercise: imagining worst-case scenario,12/6/2013
Austin Bitcoin and Cryptocurrency Meetup [7:00 pm Sunday Dec 8 @Scholz Garten 1607 San Jacinto Blvd],12/6/2013
Austin Bitcoin and Cryptocurrency Meetup [7:00 pm Sunday Dec 8 @Scholz Garten 1607 San Jacinto Blvd],12/6/2013
Which CryptoCurrency Will Receive the Most Growth in 2014? Vote StableCoin!,12/6/2013
Infinitecoin Slump? Do Not Despair!,12/6/2013
"Would you rather have missed an opportunity to buy a cryptocurrency when it was super undervalued, or missed an opportunity to sell it when it was super overvalued?",12/6/2013
I invested 100$ quintupled my investment but then lost it all and now my investment is worth 50$. The mistakes I made and the lessons I learned about markets and day-trading.,12/6/2013
What's happening?!,12/7/2013
How to beat the ups and downs of a market.,12/7/2013
A BTC bubble may be different to any other bubble that we've encountered in history. A bubble tied to an event that redistributes BTC from those that don't believe in crypto's benefits to those that do.,12/7/2013
Need help obtaining litecoins!,12/7/2013
Bitcoin Cryptocurrency Mania!,12/7/2013
n00000b here! Where the f**k do I begin?,12/7/2013
Sub $900 Light gaming / Cryptocurrency mining rig,12/7/2013
New scrypt / LTC miner,12/7/2013
[ANN]Lite-Coin mining Instructable,12/7/2013
[build help] Another high-resolution GPU question!,12/5/2013
A high-resolution GPU question,12/5/2013
Thought: Cryptocurrency funded F2P game?,12/5/2013
"Blocks, Chains, Swizzle sticks...estimates vs. numbers",12/5/2013
Just received an early Christmas present ($6000). What's the best way to invest it into cryptocurrency?,12/5/2013
2 cryptocurrencies are better than one,12/5/2013
"Datacoin - Reliable censorship-free data storage and currency - Cryptocurrency News, Bitcoin Trading Analysis",12/5/2013
Part 2: Follow-up response to “The Ripple Problem”,12/5/2013
Bitcoin - A True Believers take on where it should be,12/5/2013
Any other bitcoin landlords (bitlords) out there?,12/5/2013
Cryptocurrency directory - CCDIR,12/5/2013
I wrote this paper on the Market Morals of Bitcoin for a philosophy class at a university,12/5/2013
Improving QuarkCoin's infrastructure: Any help you can offer in accomplishing the goals in this well put together list will help QuarkCoin become the leading cryptocurrency we know that i can be.,12/5/2013
Art of Trading Bitcoin Cryptocurrency &amp; Introduction to Bitcoins Workshop (NYC) 12/13/13,12/5/2013
Improving QuarkCoin's infrastructure: Any help you can offer in accomplishing the goals in this well put together list will help QuarkCoin become the leading cryptocurrency we know that it can be.,12/5/2013
"Tools of the New Economy: Cryptocurrency, Games and POS Systems | Vitamin DWB",12/5/2013
"How to buy, sell, or trade",12/5/2013
"Bank of America Valued Bitcoin at $1,300? Fuck you!",12/5/2013
"I'm worthless, and can't even help other people",12/5/2013
My BTC and LTC story,12/5/2013
My BTC and LTC Story,12/5/2013
Anti-cryptocurrency stance: OKpay [uk],12/6/2013
To veteran miners: Skills required for an aspiring miner who wants to get serious.,12/6/2013
[Discussion] When the hell are we actually going to be able to buy high-end video cards again?,12/6/2013
An international fund for whistleblowers supported by cryptocurrency,12/6/2013
"How to get into Bitcoin, Litecoin and other CryptoCurrency in the UK",12/6/2013
"New candidate: ""Q-coin [Q] is an open cryptocurrency based on fundamentals of Informationism.""",12/6/2013
"bitcoin is to ""value"" what the internet is to ""bits""",12/6/2013
Is there any cryptocurrencies worth solo mining right now?,12/6/2013
[META] On scams vs quacks vs the bitcoin killer,12/6/2013
how much money have you lost from bitcoin?,12/6/2013
Welcome to /r/Peercoin! Quick into inside.,12/6/2013
Diversify your Cryptocurrency portfolio and a BTC is a much smaller deal to you and is made up for by the other increases.,12/6/2013
Diversify your Cryptocurrency. You don't see many people who invest in just one stock do you?,12/6/2013
Welcome to /r/Peercoin. Quick intro inside.,12/6/2013
"Making money with Bitcoins, Litecoins and other Cryptocurrency",12/4/2013
{Survey} Dear /r/CryptoCurrency which are the top 5 most innovative altcoins?,12/4/2013
Assessment of AfriCoin,12/4/2013
[Newb Question] What Happens when a cryptocurrency runs out of coins?,12/4/2013
Is Bitcoin the currency of a Type 1 civilization?,12/4/2013
Why Litecoin will flourish-The positives,12/4/2013
I run plaxant.com a cryptocurrency based news site,12/4/2013
The Cringiest Cryptocurrency,12/4/2013
I run Plaxant.com a cryptocurrency based news website. We're now offering mBTC rewards.,12/4/2013
eWeek News mentions Quark in article: Bitcoin Has Company on Cryptocurrency Stage,12/4/2013
Skype group for cryptocurrency talk.,12/4/2013
"New Idea: Peer 2 Peer, Decentralized Cryptocurrency Exchange",12/4/2013
NSA Paper written in 1996 about making a cryptocurrency,12/4/2013
Black and Grey Markets,12/4/2013
What is your ideal cryptocurrency?,12/4/2013
"Why cryptocurrency owners should stop worrying about hoarding, and learn to love it (for now)",12/4/2013
"Working on a multi-cryptocurrency local exchange, and I want some community input to help make it better. What are some of your ideas!?",12/4/2013
r/CryptoTrade - buy or sell with cryptocurrency of your choice,12/4/2013
r/CryptoTrade - buy or sell with cryptocurrency of your choice,12/4/2013
"Why isn't there a ""mutual fund"" type investment to spread risk across all the cryptocurrencies?",12/4/2013
Small time miner. Any advice?,12/4/2013
Lower yield than expected.,12/4/2013
"So now our cryptocurrency is a ""virtual commodity"" in China, how this is any ""good""???",12/5/2013
Why aren't you hoarding?,12/5/2013
Peercoin transaction...disappeared?,12/5/2013
Why the hostility against alternative cryptocurrencies?,12/5/2013
Now Accepting Litecoins and Bitcoins!,12/5/2013
Donating and The Culture Behind It,12/5/2013
Bitcoin Battles Aids/Hiv in Miami FL,12/5/2013
"Sorry Litecoin, but Bitcoin has the best cryptocurrency of all time",12/5/2013
"Call for New Bitcoin/Cryptocurrency Podcasts – 1,000 mBTC prize!",12/5/2013
REMINDER: Ask every place you makes purchases at to accept Bitcoin. It just worked for me!,12/5/2013
"Personal advice to Vendors and new/curious users advice, from someone who is a recent convert from smoking to vaping.",12/5/2013
"If you have time to refresh some forums every so often you can make some easy bitcoins, requires a little in bitcoins to start out.",12/5/2013
A Little Curious About the Information Some Sites Require,12/5/2013
Crypto Diversification &amp; New Public Good [Includes introduction of new protocol intended for use with any decentralized cryptocurrency],12/5/2013
"New to Mining, need some suggestions/encouragement.",12/5/2013
P2P Foundation: Peercoin – a cryptocurrency with built-in price stability and an energy efficient mining mechanism,12/5/2013
"I feel like I missed the bus with Bitcoin, Feathercoin a wise investment?",12/3/2013
"New to cryptocurrency, need some help with mining",12/3/2013
Are there any good cryptocurrency apps available on android?,12/3/2013
"[WTS] Steam Games: Monaco, Section 8: Prejudice, The Ship, Portal",12/3/2013
"Working on a multi-cryptocurrency local exchange, and I want some community input",12/3/2013
My response to “The Ripple Problem”,12/3/2013
Bitcoin / Cryptocurrency exchange seeking coin wallet specialist &amp; architect,12/4/2013
Kraken LTC Deposit still missing after 5 days but is in BlockChain. No reply to support requests.,12/4/2013
