title,Date
"No Money, No Lawyers, No Banks – Controversial Writer (Brian Salmi) Wants to Make Controversial Movie (Kill all the Lawyers) With Controversial Cryptocurrency (Bitcoin), Without Using Lawyers or Banks",11/15/2013
New to cryptocurrency - need some pointers on Litecoin...,11/15/2013
Successful forwarded delivery to Denmark,11/15/2013
Altcoins - Why redlisting bitcoins doesn't matter and why altcoins are actually the savior of bitcoin,11/15/2013
"Tainted bitcoins - why they don't matter and why altcoins will save bitcoins, boosting both currencies",11/15/2013
Is there a Cryptocurrency Index Fund around anywhere?,11/15/2013
"If you ever lose faith in Bitcoin...listen to this interpretation (remix) of Charlie Chaplin's ""The Great Dictator Speech"" [~4:00min]",11/15/2013
"Reddit Community Responses To Alex Waters and his ""Coin Validation"" Sanitizer (abridged from original posting that got messy)",11/13/2013
"As bitcoin grows in popularity, the bitcoin subreddit forest grows thick and unwieldy, with nearly 100 subreddits now. Can we have a discussion about organization, moderation, wikis, regional naming conventions, etc.? (List of subreddits inside.)",11/13/2013
"As bitcoin grows in popularity, the bitcoin subreddit forest grows thick and unwieldy, with nearly 100 subreddits now. Can we have a discussion about organization, moderation, wikis, regional naming conventions, etc.? (List of subreddits inside.)",11/13/2013
I'm 16. I want to get into cryptocurrency to make a few bucks.,11/13/2013
I wonder if a cryptocurrency could be used to replace concert tickets?,11/14/2013
This Swiss Cryptocurrency Trader Will Store Your Bitcoin In A Nuclear Bunker,11/14/2013
This Swiss Cryptocurrency Trader Will Store Your Bitcoin In A Nuclear Bunker,11/14/2013
Litecoin Explorer - Litecoin Cryptocurrency Blockchain Explorer,11/14/2013
Bitcoin Bible for Beginners- easy to follow intro to Cryptocurrency. Great resource for people who are just getting into bitcoin and want to learn more,11/12/2013
The three reasons my company now accepts bitcoin,11/13/2013
Bitcoin could cause a redistribution of wealth in the world?,11/11/2013
"I've decided to invest in either LTC, PPC, XPM or Ripple. Which one has the most potential?",11/11/2013
"Austin Bitcoin and Cryptocurrency Meetup 7:00pm Nov 12, Central Market on North Lamar &amp; 40th",11/11/2013
"Austin Bitcoin and Cryptocurrency Meetup 7:00pm Nov 12, Central Market on North Lamar &amp; 40th",11/11/2013
"PhotoshopWizard, reporting for duty!",11/11/2013
"Austin Bitcoin and Cryptocurrency Meetup 7:00pm Nov 12, Central Market on North Lamar &amp; 40th (from /r/bitcoin)",11/12/2013
Jumping on board. Hasn't this ship sailed?,11/12/2013
Best Place to Learn About How CryptoCurrency Works?,11/10/2013
"Tax rules apply to cryptocurrency, says the Canada Revenue Agency",11/10/2013
"Tax rules apply to cryptocurrency, says the Canada Revenue Agency",11/10/2013
What makes Bitcoin special in regards to other forms of cryptocurrency?,11/10/2013
Šta su to kripto-valute? Bitcoin kao pionir i nosioc svetske finansijsko-monetarne revolucije.,11/11/2013
Bitmit closing news oddity..,11/11/2013
Question: how does a second cryptocurrency help the first?,11/11/2013
"A new, actually anonymous, decentralized cryptocurrency.",11/11/2013
"A new, actually anonymous, decentralized cryptocurrency.",11/11/2013
Which decentralized technologies are you most interested in?,11/11/2013
Bitcoin mining contracts. BMP cryptocurrency creation.,11/9/2013
"Just a rant, a positive one though, on how amazing it is whats happening with Bitcoin",11/10/2013
Why I think the banks wont be able to kill Bitcoin.,11/10/2013
"Thinking long term here. How would mining and confirmations work with people living on another planet in the solar system. Specifically, Mars.",11/8/2013
Why can't we 'mine' messages?,11/8/2013
What are the facts needed to know before investing in litecoin ?,11/8/2013
The positive side of cryptocurrency luddites...,11/8/2013
A positive side to the cryptocurrency luddites,11/8/2013
I am always wrong about bitcoin. Why?,11/8/2013
I want to invest $1000 in cryptocurrencies. What are some good choices?,11/8/2013
I there an automated trading tool that some of you use?,11/9/2013
Looking to get involved,11/7/2013
[ANN] MITOSYS: New Encrypted Communications Cryptocurrency,11/7/2013
There's an underused Cryptocurrency called NuCoin,11/8/2013
New to cryptocurrency. Do I have the right idea here?,11/8/2013
Invest your bitcoins in the new Cryptocurrency Investment Fund,11/8/2013
"""Don't complain to me when one Bitcion is worth 1 million dollars."" - Bitcoin enthusiast from 4chan yesterday",11/8/2013
When will the bitcoin price reach 1337 dollars for one bitcoin?,11/8/2013
When will the bitcoin price reach 1337 dollars for one bitcoin?,11/8/2013
Application of statistical mechanics to financial markets. The Bitcoin economy can use a fresh perspective.,11/6/2013
"/r/ALTcointip, home of open-source cryptocurrency bot",11/6/2013
http://btcmachin.es (BTC machines Trade) is an advanced web-based trading tool for cryptocurrency exchange,11/6/2013
http://btcmachin.es (BTC machines Trade) is an advanced web-based trading tool for cryptocurrency exchange,11/7/2013
http://btcmachin.es (BTC machines Trade) is an advanced web-based trading tool for cryptocurrency exchange,11/7/2013
http://btcmachin.es (BTC machines Trade) is an advanced web-based trading tool for cryptocurrency exchange,11/7/2013
My repost: Can we get back to actually discussing Bitcoin rather than the exchange rate of Bitcoin?,11/7/2013
The LTC Rise: What innovations will come of it.,11/7/2013
Third largest cryptocurrency PPCoin moves into spotlight with Vault of Satoshi deal,11/7/2013
Is it possible for bitcoin (or any virtual currency) to be based on useful computationally useful computations? Sorry for the confusing wording.,11/5/2013
Craftcoin - Minecraft Game Currency as Cryptocurrency,11/6/2013
72-hour Peercoin Press Rush Discussion Thread,11/6/2013
"I wanted to buy my first bitcoin a month ago, but only recently figured out how to do it. What can we do to make it easier for the general public?",11/4/2013
What do you guys think about this? New cryptocurrency donates your unused CPU power for Scientific Research as a way of mining coins. Gridcoin.,11/4/2013
What do you guys think about this? New cryptocurrency donates your unused CPU power for Scientific Research as a way of mining coins. Gridcoin.,11/4/2013
Gridcoin + Boinc = Scientific Cryptocurrency Of The Future,11/4/2013
This Swiss Cryptocurrency Trader Will Store Your Bitcoin In A Nuclear Bunker,11/5/2013
Bitcoin Cryptocurrency Meetup [Tuesday Nov 4 at 7:00pm],11/4/2013
Bitcoin Cryptocurrency Meetup [Tuesday Nov 4 at 7:00pm],11/4/2013
Bitcoin Cryptocurrency Meetup [Tuesday Nov 4 at 7:00pm],11/4/2013
Bitcoin and Cryptocurrency Meetup in Austin Texas [Tuesday Nov 5: 7:00 pm],11/4/2013
Bitcoin and Cryptocurrency Meetup in Austin Texas [Tuesday Nov 5: 7:00 pm],11/4/2013
Bitcoin and Cryptocurrency Meetup in Austin Texas [Tuesday Nov 5: 7:00 pm],11/4/2013
"In Case you Haven't Read the 2nd Community Interview with Sunny King Because you Haven't Signed up at the Forum yet, Here it is...",11/2/2013
"Adventurer to make first ever bitcoin transaction from the South Pole - Cryptocurrency News, Cryptocoins News",11/3/2013
Modern Culture Cannabis Vendor,11/1/2013
Happy Halloween Release - Modern Culture Medical Cannabis [Escrow][.onion][.i2p],10/31/2013
Happy Halloween Release - Modern Culture Medical Cannabis [Escrow][.onion][.i2p],10/31/2013
Litecoin unit naming proposal- lets act now!,11/1/2013
Proposal for Litecoin unit naming - Lets act now!,11/1/2013
Circle - new cryptocurrency company,10/31/2013
"Want to start teaching classes/seminars again, need some sales/marketing input.",10/31/2013
Happy Halloween Release - Modern Culture Medical Cannabis [Escrow][.onion][.i2p],10/31/2013
Happy Halloween Release - Modern Culture Medical Cannabis [Escrow][.onion][.i2p],10/31/2013
Happy Halloween Release - Modern Culture Medical Cannabis [Escrow][.onion][.i2p],10/31/2013
Happy Halloween Release - Modern Culture Medical Cannabis [Escrow][.onion][.i2p],10/31/2013
Happy Halloween Release - Modern Culture [Escrow][.onion][.i2p],10/31/2013
Happy Halloween Release - Modern Culture [Escrow][.onion][.i2p],10/31/2013
You've probably heard a lot of reasons why Bitcoin is 'revolutionary'. Here's why it's stupid.,10/29/2013
Coming to Terms With Sound Money,10/29/2013
Bitcoin and Google Glass,10/29/2013
What tasks are possible with 2x Pi model B's that are impossible to do even half as well with only 1?,10/30/2013
"Want to start teaching classes/seminars again, need some sales/marketing input.",10/30/2013
"Talking Bitcoin, Cryptocurrency, Bitcoin projects, Economics, and whatever else. (Austin , 7:00pm Tuesday)",10/28/2013
Small businesses in san marcos accepting bitcoins,10/28/2013
Bitcoin and cryptocurrency analysis + one more thing – Week 44,10/29/2013
"Talking Bitcoin, Cryptocurrency, Bitcoin projects, Economics, and whatever else. (Austin , 7:00pm Tuesday)",10/28/2013
/r/ppcoin has moved to r/peercoin,10/26/2013
Randoms From Me,10/27/2013
"Welcome, take a look at the links for the newly launched CryptoCurrency, Tagcoin",10/27/2013
What's to stop a government from making their own cryptocurrency?,10/26/2013
What are some advantages other present or future cryptocurrencies could have over bitcoin?,10/24/2013
"""The World's First Cryptocurrency-based Political Zone"" - Listen to his description of the opt-in legal system! Who's moving with me?",10/24/2013
What would you rather have? Cryptocurrency become the world currency of today or...,10/24/2013
Scrypt-based miners and the new cryptocurrency arms race,10/25/2013
Wells Fargo Compliance Consultant called me about my coinbase activity. Is this good or bad?,10/23/2013
"Mastercard Hates Bitcoins - Cryptocurrency News, Cryptocoins News",10/24/2013
Scrypt-based miners and the new cryptocurrency arms race,10/23/2013
Announcing the CryptoConnection!,10/21/2013
Announcing the CryptoConnection!,10/21/2013
Announcing the CryptoConnection,10/21/2013
"Struggling to understand how Hyberboria and the meshnet, is supposed to work (long reads)",10/22/2013
Women and Cryptocurrency,10/21/2013
"[Table] IAmA: I'm Rick Falkvinge, founder of the first Pirate Party and subsequent author of ""Swarmwise: the tactical manual to changing the world"". AMA.",10/21/2013
Women and Cryptocurrency,10/21/2013
"Bitcoin and Cryptocurrency Meetup in Austin (Tuesday Oct 22, 7:00pm)",10/21/2013
The Taming of the Shrew: Investment Banking the Cryptocurrency,10/20/2013
Litecoin Cryptocurrency,10/20/2013
"John Stossel is questioned on Bitcoin and The Silk Road Shutdown, Stossel shares his views on the Cryptocurrency and the legalization of Drugs in America. This speech was part of Truth Week at Penn State University.",10/17/2013
Why the high cost of protecting against a 51% attack makes proof of work unsustainable.,10/18/2013
"Litecoin seems to be plummeting - Cryptocurrency News, Cryptocoins News",10/18/2013
"[FORHIRE]Tarot Reader: Futures Foretold, Reasonable Rates",10/16/2013
Money is a universal representation of value. Each community should be equipped with a credit facility of infinite numerical capacity to pay for the human labour required within communities. CMV.,10/17/2013
Team America: World Internet Police or Region for the Next Silk Road to Avoid,10/15/2013
Team America: World Internet Police or Region for the Next Silk Road to Avoid,10/15/2013
Started getting into the Cryptocurrency hobby.,10/16/2013
"Bitcoin and Cryptocurrency Meetup, Tuesday (10/15) 7:00pm",10/14/2013
PPCoin/Primecoin Weekly Updates,10/14/2013
Criticisms of Proof-of-stake,10/15/2013
"[Help needed] Which ""Adam Cohen"" is the moron who said ""Bitcoin is a ludicrously bad idea. It is a scam. A Scam."", back in May 2011? http://www.quora.com/Bitcoin/Is-the-cryptocurrency-Bitcoin-a-good-idea/answer/Adam-Cohen-2",10/13/2013
Edan Yago - The World's First Cryptocurrency-based Political Zone - Bitcoin 2013,10/10/2013
[ANN] cryptothrift - BitCoin and LiteCoin Auction Site with Escrow,10/10/2013
[ANN] cryptothrift - BitCoin and LiteCoin Auction Site with Escrow,10/10/2013
[ANN] cryptothrift - BitCoin and LiteCoin Auction Site with Escrow,10/10/2013
Will the TPP make BTC illegal?,10/9/2013
Silk Road Takedown And The Future Of Cryptocurrency,10/10/2013
"Assuming one day BTC becomes quite scarce and sought after, what is to stop people who 'missed out' from adopting an alternate cryptocurrency and rendering the value of BTC useless?",10/10/2013
"Hi, /r/Bitcoin. Could I have a moment of your time? I'm a second-year law student and staff editor of my school's Law Review.",10/7/2013
InfiniteXC.com - A CryptoCurrency Exchange Site with numerous other features allowing for investments as well!,10/6/2013
I don't think you realize how important the takedown Silk Road and the other online 'black market' Atlantis really was.,10/7/2013
Calling all Bitcoin/Cryptocurrency/FinTech Startups: Pitch at EXPO on 12/5/2013!,10/7/2013
Due to bitcointalk being down the PPCointalk forums have added Alt-coin sections.,10/5/2013
ELI5: How can a Bitcoin (or other cryptocurrency) be broken up into pieces?,10/6/2013
Who's in Atlanta tomorrow for the Cryptocurrency Con?,10/3/2013
Fluctuations in Future Bitcoin Value.,10/3/2013
Bitcoin and Future Black Markets.,10/4/2013
"Namecoin Website Reviews, Ordered By Rating; You can submit your favorite cryptocurrency sites and reviews and earn Bitcoin and other rewards ...",10/4/2013
Novice did some poking around &amp; it doesn't look like drug users on TOR have too much to worry about re: new markets,10/2/2013
The real reasons Silk Road was (allegedly) taken down,10/2/2013
The Future Of Cryptocurrency - tradersnetwork.biz - list trade smile :),9/30/2013
Just introducing myself - sorry if this is the wrong place,9/30/2013
BrieHost launches and accepts any publicly traded cryptocurrency as payment,10/1/2013
Bitcoin Limbo,10/1/2013
Bitcoin Cryptocurrency Crash Course with Andreas Antonopoulos,9/29/2013
"Austin Bitcoin, Cryptocurrency Meetup (Tuesday, Oct 1, 7:00pm)",9/30/2013
"Austin Bitcoin, Cryptocurrency Meetup (Tuesday, Oct 1, 7:00pm)",9/30/2013
I am new and have joined Slush. I get ~110 Mh/s. Is this worth the electricity investement?,9/28/2013
I am new and have joined Slush. I get ~110 Mh/s. Is this worth the electricity investement?,9/28/2013
I am new and have joined Slush. I get ~110 Mh/s. Will this make any substantial amount/month?,9/28/2013
Bitcoin Cryptocurrency Crash Course with Andreas Antonopoulos - Jefferson Club Dinner Meetup,9/29/2013
Reboot bitcoin,9/28/2013
"Is there any use in forking the Ripple source code, getting rid of all of the bullshit, and setting it up as a decentralized currency exchange?",9/27/2013
Bitcoin Cryptocurrency Crash Course with Andreas Antonopoulos,9/25/2013
1 Acre Lake Lot in Northern California (Utilities) selling for Litecoin cryptocurrency,9/26/2013
Bitcoin Cryptocurrency Crash Course with Andreas Antonopoulos,9/26/2013
[ANN][SBC] StableCoin ¦¦ A new breed of cryptocurrency ¦¦ v1.2 RELEASED,9/26/2013
Alternate Cryptocurrency: Stablecoin Start 7 Jun 2013 1700 GMT,9/26/2013
Colored coins (decentralized exchange): we need developers to complete client implementation faster,9/26/2013
Any Cryptocurrency Profitable on Gaming Desktop Anymore?,9/24/2013
"Need help investing in a Bitcoin ASIC Mining expansion, Cryptocurrency trading, and Reputation loan",9/25/2013
Offerings to Cthulhu - A cryptocurrency,9/25/2013
"absolute noob, advice is helpful",9/25/2013
Any Bitcoin users in Exeter?,9/23/2013
"[Hiring] Work the Let's Talk Bitcoin table at the CryptoCurrencyCon! Saturday the 5th of October in Atlanta, Georgia",9/24/2013
Things that have started to annoy me since researching bitcoin,9/20/2013
Jeffrey Tucker speaks about CryptoCurrency Conference,9/19/2013
Jeffrey Tucker speaks about CryptoCurrency Conference,9/19/2013
"Jeffrey Tucker speaks about CryptoCurrency Conference, which is Oct 5, 2013",9/20/2013
"homeless guy surviving on cryptocurrency, laptop dies mid-videogame. so hightechlowlife",9/20/2013
The upcoming decentralization of the global economy,9/19/2013
Welcome to ALTcointip!,9/17/2013
[Bitcoin giveaway!] Come try the cryptocurrency tip bot I've built and receive free Bitcoins to get started!,9/17/2013
[Bitcoin giveaway!] Come try the cryptocurrency tip bot I've built and receive free Bitcoins to get started!,9/17/2013
"Talking Bitcoin, Cryptocurrency and various Bitcoin projects in Austin Texas",9/16/2013
"Talking Bitcoin, Cryptocurrency and various Bitcoin projects in Austin Texas",9/16/2013
"In 2011 Bitcoin was $1. Now it's at $130. Where it will go, no one knows, but if you're familiar with cryptocurrency - it has forever changed money.",9/17/2013
BottleCaps Cryptocurrency,9/15/2013
BottleCaps Cryptocurrency,9/15/2013
"""‘Surfing the Silk Road’: A study of users’ experiences"", Van Hout &amp; Bingham 2013",9/15/2013
New Cryptocurrency Subreddit AndroidsTokens (ADT) - /r/AndroidsTokens!,9/15/2013
The Future Of Cryptocurrency,9/14/2013
[Bitcoin giveaway!] Come try the cryptocurrency tip bot I've built and receive free Bitcoins to get started!,9/12/2013
Concern about pool operators,9/12/2013
The future.,9/12/2013
Idea validation,9/13/2013
I have an offer that someone might find interesting.,9/11/2013
The Future Of Cryptocurrency - Investopedea,9/12/2013
So I asked /r/anarchism if they support or endorse bitcoin and cryptocurrency...,9/12/2013
.:Call for submissions:. BitcoinD and CryptocoinD -- crowdsourced directory and search engine,9/10/2013
.:Call for submissions:. BitcoinD and CryptocoinD -- crowdsourced directory and search engine,9/10/2013
"From Bitcoin to Peercoin/P2PCoin/PPCoin: Fundamentally, as a cryptocurrency PPC &gt; BTC and PPCoin will outperform Bitcoin long-term. Here's why...",9/11/2013
The Future Of Cryptocurrency,9/11/2013
The Future Of Cryptocurrency,9/11/2013
Austin Bitcoin and Cryptocurrency Meetup,9/9/2013
The most cogent arguments cryptocurrency always come from libertarian bitcoiners. Bonus points for PM stalking!,9/10/2013
The most cogent arguments for cryptocurrency always come from libertarian bitcoiners. Bonus points for PM stalking!,9/10/2013
How many kids actively use Bitcoin and/or any other Cryptocurrency?,9/10/2013
Off Chain services or online wallets will become new fractional reserve system,9/8/2013
Anoncoin (ANC) claims to be the first cryptocurrency that will actually implement Zerocoin,9/9/2013
CoinMKT Beta has launched: first totally compliant multi-cryptocurrency/fiat exchange,9/7/2013
Hiring a Cryptocurrency devloper for a auction website like Bitmit,9/6/2013
Has anyone thought of trying to get litecoin intergrated into online games?,9/7/2013
[PSA] I am here to answer questions regarding Bitcoin transactions on /r/SGS. AMA.,9/7/2013
Subreddit Stats: bitcoin top posts from 2013-08-07 to 2013-09-05 23:34 PDT,9/7/2013
I put on fox news tonight (something i rarely do anymore) and a wild cryptocurrency appeared!,9/5/2013
Entering The Exciting World Of BitCoin and CryptoCurrency Speculation,9/5/2013
Is there a way to convert different types of cryptocurrency to each other?,9/5/2013
"CoinMKT exchange opens in 2 days, let's ask them to support Primecoin!",9/4/2013
"Talking Bitcoin, Cryptocurrency, and various Bitcoin projects - Bitcoin and CryptoCurrency in Austin (Austin, TX)",9/2/2013
"Talking Bitcoin, Cryptocurrency, and various Bitcoin projects - Bitcoin and CryptoCurrency in Austin (Austin, TX)",9/2/2013
"Talking Bitcoin, Cryptocurrency, and various Bitcoin projects - Bitcoin and CryptoCurrency in Austin (Austin, TX)",9/2/2013
Canada has a marketing group working in favor of Bitcoin and a new restaurant that accepts cryptocurrency,9/3/2013
Canada has a marketing group working in favor of Bitcoin and a new restaurant that accepts cryptocurrency,9/3/2013
Cryptocurrency Directory,9/3/2013
As a Bitcoin supporter: What's the appeal of the various altcoins?,9/2/2013
Cryptocurrency ATM: Lamassu ships its first 15 Bitcoin Machines,9/2/2013
Presenting the Nucleus Proposal &amp; Futurology Github Organization: Let's Drive Meaningful Labor Change Through Intelligent Open Source Web Software,9/2/2013
Thanks to Silfax for setting up a bitcoin checkout for me.,8/31/2013
"I am a time-traveler from the future, here to beg you to stop what you are doing.",8/30/2013
Introducing FastCoin – The World’s Fastest Bitcoin Alternative Gaining Traction in The Cryptocurrency Ecosystem,8/29/2013
Need ideas for Bitcoin booth at school fair,8/26/2013
"Process based Democratic Meritocracy, Looking for Input",8/25/2013
An Insiders Take on CoinTerra &amp; the Bitcoin Mining Sector,8/24/2013
"New CryptoCurrency with an interesting concept, but do the economics add up?",8/24/2013
Can cryptocurrency like bitcoin be used to power a decentralized social website similar to facebook?,8/25/2013
"The Rules, and some helpful tips (as of Aug 2013)",8/25/2013
"New to cryptocurrency, and I was wondering if mining on a cpu makes sense.",8/25/2013
[Table] IAmA: I am Ron Paul: Ask Me Anything.,8/22/2013
"Try CryptoTrade for all your cryptocurrency trading needs.  Bitcoin, Litecoin, Namecoin and many more.  Safe, Secure, Low Fees. ",8/23/2013
"Mind checking our crypto? New, fully encrypted cryptocurrency",8/21/2013
Tonight 7-9pm: Meet up to discuss Bitcoin &amp; cryptocurrency opportunities - Los Angeles Bitcoin (Wokcano in Santa Monica),8/21/2013
CryptoCurrency Forum,8/21/2013
Bitcoinvention Asia 2013 will show why cryptocurrency “is the next solution” for the Asian market,8/20/2013
100% anonymous cryptocurrency in development,8/21/2013
"New, 100% anonymous, cryptocurrency, currently in beta",8/21/2013
New cryptocurrency with full encryption. Please check our crypto?,8/21/2013
Cryptocurrency-based Android market?,8/19/2013
"Austin Texas Bitcoin Meetup tonight, 7:00 pm Central Market on Lamar",8/20/2013
cryptothrift - BitCoin and LiteCoin Auction Site,8/19/2013
Some pretty long title about something and nothing and just to be able to test how certain things deal with extra lengthy title - random,8/18/2013
Who Should We Invite to write for the LTB Guest Blog?,8/18/2013
Decoding Bitcoin... Politico Introduces their Audience to Cryptocurrency!,8/16/2013
[WTS] Litecoin mining rig - ready to go - Australia - NSW,8/15/2013
"Idea for truly anonymous, untraceable bitcoin - that could be integrated into the bitcoin protocol itself",8/15/2013
Can cryptocurrency like bitcoin be use to power something similar to Tor network?,8/13/2013
"Bitcoin and Cryptocurrency Meetup this Saturday, Aug 17",8/14/2013
"Austin Bitcoin and Crypto Currency Meetup, Aug 13 AND Aug 17",8/12/2013
"Austin Bitcoin and Crypto Currency Meetup, Aug 13 AND Aug 17",8/12/2013
"Austin Bitcoin and Crypto Currency Meetup, Aug 13 AND Aug 17",8/12/2013
"Austin Bitcoin and Crypto Currency Meetup, Aug 13 AND Aug 17",8/12/2013
Congress starts investigating Bitcoin,8/13/2013
What would happen to bitcoin if a better cryptocurrency appears?,8/10/2013
[Hiring] Responsible college students at any brick and mortar school in the country to post flyers (x-post r/youngjobs).,8/10/2013
Bees Brothers: young cryptocurrency entrepreneurs keep thriving and already mined their first Bitcoin,8/11/2013
NeoCoin - a new 2nd gen cryptocurrency launching on Sat 8/10. Not just another Bitcoin clone.,8/9/2013
Namecoin promotional idea,8/9/2013
"[FOR HIRE] Graphic designer for customer logos, shirts, comics, &amp; photomanipulation",8/10/2013
"[FOR HIRE] Graphic designer for customer logos, shirts, comics, &amp; photomanipulation",8/10/2013
"Interview with American Hacker Jeffrey Paul on Bitcoin, Cryptocurrency and Security",8/10/2013
Goldcoin the new Litecoin/Bitcoin,8/10/2013
Isn't Bitcoin a deflationary currency? Why is that good (for a currency)?,8/8/2013
Welcome!,8/8/2013
How to stop centralization X-Post from Cryptocurrency.,8/7/2013
What did you think will change the World in the near future but only a few people are aware of it,8/7/2013
Buttonwood SF #6 OTC Cryptocurrency Trading Group this Thursday @ 7PM PST,8/5/2013
“Bitcoin and the Future of Money”: October 2013 CryptoCurrency Conference,8/6/2013
"[Table] IAmA: I am Carne Ross, one of the founders of the Occupy Money Cooperative.",8/4/2013
List of UK organisations who take Bitcoin,8/5/2013
"Earn BTC, LTC, and DGC by recommending Pool-Anything.com to others",8/4/2013
"Cryptocurrency Trader - SP prices, SS orders, Set your own rules - Public source",8/4/2013
DCX - The Digital Currency Index Project (x-post from /r/BitCoinStocks),8/4/2013
"NEW SUB! /r/Bitcointipbay. Sell galleries to individual tippers. You name the price, they tip, you PM/email gallery/requests.",8/1/2013
"NEW SUB! /r/Bitcointipbay. Sell to individual tippers. You name the price, they tip, you PM/email work.",8/1/2013
Where can I purchase litecoins with bitcoins?,8/1/2013
What are the most computationally intensive Math problems?,8/2/2013
Mobile Wallet List X-Post from Cryptocurrency,7/31/2013
Mobile Wallets List X-Post from Cryptocurrency,7/31/2013
[Test] I,7/31/2013
[Test] II,7/31/2013
[Test] III,7/31/2013
HackMiami to Unveil Live Linux Cryptocurrency Mining Distribution During Defcon Skytalks at Las Vegas Hacking Conference,8/1/2013
Does the maker-taker model apply for Cryptocurrency exchanges?,8/1/2013
[ForHire] Web developer / Litecoin integration consultant,8/1/2013
[ForHire] Web developer / Bitcoin integration consultant,8/1/2013
Bitcoin's Watershed Moment: An Open Source Cryptocurrency Ecosystem,7/30/2013
"Bitcoin's Watershed Moment, An Open-Source Cryptocurrency Ecosystem",7/30/2013
London Cryptocurrency Meetup - Weds 7th August Twickenham,7/29/2013
"Austin Bitcoin and Cryptocurrency Meetup, Tuesday July 30th, 7:00pm",7/29/2013
"Austin Bitcoin and Cryptocurrency Meetup, Tuesday July 30th, 7:00pm",7/29/2013
