title,Date
"Reddit musician /u/thesleepsessions flies the flag for promoting music via BitCoin/LiteCoin. A little research shows he's been accepting Cryptocurrency only for nearly 12months. THIS is why the internet, and people using it, are great.",12/4/2013
"I was interested in getting into it, but I can't.",12/4/2013
Introducing Dogecoin (xpost /r/CryptoCurrency),12/4/2013
2014 Cryptocurrency Calendar,12/4/2013
2014 Cryptocurrency Calendar,12/4/2013
"Out of curiosity, how much money do you have tied up in cryptocurrency?",12/4/2013
[Beg] Looking for any kind of assistance to get the overseas cryptocurrency newbies on their way!!!,12/4/2013
Moveco.in - All your Bitcoin/Cryptocurrency addresses in one place!,12/4/2013
Cryptocurrency 101 : What the #@*&amp; is Bitcoin?,12/4/2013
Cannot Unlock/Decrypt Litecoin Wallet,12/4/2013
Moveco.in - All your cryptocurrency addresses in one place,12/4/2013
Will Quark fight back?,12/4/2013
"Was looking for Cryptocurrency exchanges that support Metatrader, and came across this. Don't know if it's a scam, but made me lol in my cube @ work.",12/4/2013
ELI5 StableCoin anonymity?,12/4/2013
Mining crypto currencies in general?,12/4/2013
How to use your GPUs to support bitcoins and hinder altcoins,12/4/2013
Bitcoin Has Company on Cryptocurrency Stage,12/4/2013
Mining Litecoin from my gaming PC?,12/2/2013
"Three Hares Bazaar - Bitcoin, Peercoin, Litecoin, Namecoin support",12/2/2013
What if someone makes an alt-currency named Bitcoin?,12/2/2013
Mine alt's and exchange or Mine LTC straight?,12/2/2013
"I'm a recent graduate, opened a cafe/bakery in London and I want to accept Bitcoin. Help?",12/2/2013
"Are there cryptocurrencies with features ""different"" from bitcoin?",12/2/2013
Crypto-Knight: The Fastest/Safest Way to Invest in Cryptocurrency.,12/2/2013
A friend of a friend set up a free site for tracking cryptocurrency investments and equities. Come check it out!,12/2/2013
[ANN][SBC] StableCoin Global Awareness Campaign - First Stop: China,12/2/2013
Why the CryptoCurrency crash this weekend?,12/2/2013
A friend made a free website for tracking your cryptocurrency and equity investments using public-keys and read only APIs. Come check it out!,12/2/2013
Could a cryptocurrency be based off protein folding?,12/2/2013
"The new BBQCoin foundation is looking kinda bland, no?",12/2/2013
A friend made a free website for tracking your cryptocurrency and equity investments using public-keys and read only APIs. It is now in open beta.,12/2/2013
"What are the features of your ""ideal"" CryptoCurrency?",12/2/2013
A friend made a free website for tracking your cryptocurrency and equity investments using public-keys and read only APIs. It is now in open beta.,12/2/2013
"Any fellow knights jumping into cryptocurrencies (Bitcoin, Litecoin, Megacoin, Peercoin, etc.)? Details inside!",12/2/2013
IFC Marketplace,12/3/2013
Namecoin is reusing 99% of Bitcoins hash-power and consumed energy and it is the most energy efficient cryptocurrency,12/3/2013
Largest forum in Europe opens a Cryptocurrency sub-forum (Dutch),12/3/2013
The Compounding Risk of Cryptocurrency Alt-Coins and the Impending Alt-Coin crash.,12/3/2013
The Compounding Risk of Cryptocurrency Alt-Coins and the Impending Alt-Coin crash.,12/3/2013
CoinVibes: A Unified Cryptocurrency Exchange API,12/3/2013
Cryptick - Cryptocurrency Market Ticker,12/3/2013
"How to Buy, Sell &amp; Become a CryptoCurrency God",12/3/2013
Just looking for a proper discussion on altcoins especially LTC. All current arguments could be applied to BTC not so long ago.,12/3/2013
all altcoin cryptocurrency news / discussion,12/3/2013
"Fellow Ancaps, I was wrong about Bitcoin.",12/3/2013
This is what is wrong and why Crypto Currencies are doomed,12/3/2013
"Dear my fellow Ancaps, I was wrong about Bitcoin.",12/3/2013
Help combat Aids/Hiv With cryptocurrency!,12/3/2013
"Bitcoin, Math, and the NSA",12/3/2013
"Bitcoin, Math, and the NSA",12/3/2013
Anoncoin! make sure cryptocurrency will still be available for use if central banks decide to crack down #bitcoin,12/3/2013
"Quarkcoin currently 5th largest cryptocurrency, trailing behind Namecoin",12/1/2013
Would mining be worth it at this point?,12/1/2013
Is there any way to solo mine without downloading the blockchain first?,12/1/2013
Gathering ideas for an informational site,12/1/2013
Send Bitcoin or Cryptocurrency as Christmas gifts,12/1/2013
Quark Coin: Scam or Next Big Cryptocurrency?,12/1/2013
What's next?,12/1/2013
"[H] Unusual Planets that orbit around a metal Heavy's Chullo. [W] Gaimz, Kees, speeling lesons, strange festives, bit/litecoin, ofers.",12/1/2013
Formerly Unrealistic Business Ideas Made Possible by Bitcoin,12/1/2013
Bitcoin has extended my range of opportunism as well as altruism,12/1/2013
"/r/coinjobs - Will work for cryptocurrency. Post classified ads to hire someone for BTC, or to find a gig on the side.",12/1/2013
Litecoin Cryptocurrency Review,12/1/2013
Looks like people are trying to get Quark labeled as a scam anywhere this can. This time /r/cryptocurrency,12/2/2013
$30k logo competition for top cryptocurrency.,12/2/2013
I'm here to help you develop and brainstorm cryptocurrency ideas.,12/2/2013
November 2013 has all chances to become the hottest month of the year in the history of cryptocurrency. This is a monthly review on digital currency leading news from The Coin Telegraph.,12/2/2013
November 2013 has all chances to become the hottest month of the year in the history of cryptocurrency. This is a monthly review on digital currency leading news from The Coin Telegraph.,12/2/2013
Trading from a foreign country.,12/2/2013
"The amazing tale of a Bitcoin, a Litecoin and a Namecoin!",12/2/2013
Cryptocurrency Deflation: The Numbers Just Don't Add Up,12/2/2013
Cryptocurrency Board [Serious],12/2/2013
Nerdy Cryptocurrency Shirts,12/2/2013
What features would your ideal cryptocurrency have?,12/2/2013
"While not a complete noob to cryptocurrency,still need a few answers.",12/2/2013
Is it just me or is 90% of the mining being done on the same pool?,12/2/2013
A Lot Of ‘Religion’ In Cryptocurrencies?,12/2/2013
Capital Gains/Foreign Currency taxes,12/2/2013
Group buy on Litecoin Super Miner:,12/2/2013
"/r/economy apparently does not share Bitcoin enthusiasm that much, citing issues with inherent deflation and volatility. How would alternative cryptocurrency, designed by actual economists instead of anarchist internet fans of Austrian school look like?",12/2/2013
Bitcoin 101: Understanding Cryptocurrency,12/2/2013
11 Historical Bitcoin moments: a pictorial countdown of the cryptocurrency history,12/2/2013
Bitcoin vs. other cryptocurrencies,12/2/2013
"Austin Bitcoin and Cryptocurrency Meetup [Sholtz Garten, 7:00 pm Tuesday Dec 3]",12/2/2013
"Austin Bitcoin and Cryptocurrency Meetup [Sholtz Garten, 7:00 pm Tuesday Dec 3]",12/2/2013
"Austin Bitcoin and Cryptocurrency Meetup [Sholtz Garten, 7:00 pm Tuesday Dec 3]",12/2/2013
[PSA] /r/CryptoMarkets for Technical Analsyis and /r/CryptoMarket for a Multi-Cryptocurrency Marketplace,12/2/2013
[PSA] /r/CryptoMarkets for Technical Analysis and /r/CryptoMarket for a Multi-Cryptocurrency Marketplace,12/2/2013
"Parallels with the empires built on slave trade: ""how did you make your wealth?"" ""I wrote viruses, spread them, and ran a botnet.""",11/30/2013
I propose a planet-based grading system for cryptocurrencies based on their spot rate,11/30/2013
Need help filling out Western Union transfer to Vault of Satoshi; clerk was of no help,11/30/2013
Bitcoin's chance of $100K per BTC is actually very likely and is not that much,11/30/2013
"With the block size of Bitcoin being tested, how much money will flow into Litecoin as the most viable alternative?",11/30/2013
The Plan,11/30/2013
The 0% trade fee in China and its culture background (x-post CryptoCurrency),11/30/2013
Cryptocurrency Q&amp;A Thread,11/30/2013
Why do people support this poison?,11/30/2013
"A warning to the cryptocurrency community regarding a Cryptsy Peercoin ""pump and dump"" at Sunday December 1st, 11 p.m. EST.",11/30/2013
"A warning to the cryptocurrency community regarding a Cryptsy Peercoin ""pump and dump"" at Sunday December 1st, 11 p.m. EST.",11/30/2013
"Penis joke, boobies, cat picture/meme, brilliant observation and clever pun about cryptocurrency. That is all.",11/30/2013
"A warning to the cryptocurrency community regarding a Cryptsy Peercoin ""pump and dump"" at Sunday December 1st, 11 p.m. EST. (may affect Litecoin)",11/30/2013
You can ride out the latest bitcoin crash with a profit by investing some into other cryptocurrency since it raises at Bitcoin crashes.,11/30/2013
The thing most people that lose their coins have in common: they store them in someone else's wallet,11/30/2013
What's wrong with the other exchanges? (Repost from /r/Cryptocurrency,11/30/2013
"A warning to the cryptocurrency community regarding a Cryptsy Peercoin ""pump and dump"" at Sunday December 1st, 11 p.m. EST.",11/30/2013
[ForHire] Buy a law: Signature drive management for referendum appearing in 2016,12/1/2013
LTC is not the silver to BTC's gold.,12/1/2013
"Instead of panic buying laptops, why not consider moving some of your money to another major Cryptocurrency?",12/1/2013
Trading Terminology,12/1/2013
I think it's time I face the reality...,12/1/2013
Why invest into ripple?,12/1/2013
"How to Buy, Sell &amp; Become a CryptoCurrency God",12/1/2013
Watch All Talks/Panels from Jeffrey Tucker's CryptoCurrency Conference for Free!,12/1/2013
Lets put some pressure om MTgox implementing LTC!,12/1/2013
Watch the Entire Bitcoin &amp; Cryptocurrency Conference from October 2013 in Atlanta Georgia for free,12/1/2013
"New to cryptocurrency, what is happening?",12/1/2013
What I learned with Litecoin trading,12/1/2013
Coming Soon - $1000 part II: The Cryptocurrency Strikes Back!,12/1/2013
"The cryptocurrency revolution is here. Join Block Eater, the Litecoin mining pool and community.",11/29/2013
Frankos Cryptocurrency Overview,11/29/2013
Bitcoin generosity,11/29/2013
Please give me feedback on my HTPC build,11/29/2013
"Doesn't the privacy policy of places like Coinbase, defeat the purpose of anonymity and cryptocurrency of Bitcoin? They need to know your name, bank info, who, what, where, when, why, monitor your PC activity.",11/29/2013
Please explain the value of the other alt-currencies?,11/29/2013
Good CryptoCurrency applications?,11/29/2013
What is to prevent other crypto currencies from taking over from Bitcoin?,11/29/2013
"Thanks to a friend of mine, I've decided to take bitcoin in exchange for my music!",11/30/2013
Can Peercoin (PPC) replace Bitcoin (BTC) as the primary cryptocurrency?,11/30/2013
The value of bitcoin will crash because the protocol and software are not yet ready for the world's stage.,11/30/2013
EXPLAINED: Why Peercoin is a Big Deal,11/30/2013
Why Altcoins are growing faster than Bitcoin,11/30/2013
To All Megacoin Newcomers (Please Read),11/30/2013
Help with creating general steps toward investing in altcoins and securely managing funds?,11/30/2013
[Hiring] 50 Dollars for 20 minutes of work or less.,11/30/2013
"Along with BTC, I recently added multiple cryptos for donations for my music releases on Bandcamp.",11/30/2013
A different cryptocurrency.,11/28/2013
Ideas that will change how you look at the world.,11/28/2013
paypal-&gt;IFC?,11/28/2013
Noob question - what's the best way to sell LTC in the UK?,11/28/2013
I came up with this quote just a few minutes ago. I thought /r/bitcoin would appreciate,11/28/2013
P2P Cryptocurrency to support P2P Filesharing,11/28/2013
What exchange do you use and why?,11/28/2013
Could Bitcoin be orchestrated by the NSA?,11/28/2013
The biggest problem of Bitcoin is that people simply do not understand cryptocurrency.,11/28/2013
Why cryptocurrency sucks - a thoughtful discussion.,11/28/2013
Why cryptocurrency sucks - a thoughtful discussion.,11/28/2013
My first transaction with Bitcoin. It's mind-blowing!,11/29/2013
AuraWallet : Multi-Cryptocurrency management tool for mobile users + Merchant Processing Support,11/29/2013
Looking for some help regarding a UK trade,11/29/2013
Bitcoin valuation theory/theories,11/29/2013
Using bitcoin technology to make a perfect voting system?,11/29/2013
What is the best website to purchase multiple alt cryptocurrency ?,11/29/2013
question about bitcoin,11/29/2013
What is the best wallet out there?,11/29/2013
Buying currency,11/29/2013
serious question about bitcoin,11/29/2013
"[WTB] Computer Parts (GPU, Mouse, Keyboard)",11/29/2013
Pensamentos de 7 famosos sobre Bitcoin,11/29/2013
Litecoin Explorer - Litecoin Cryptocurrency Blockchain Explorer,11/29/2013
"Terminology (infrastructure, crypto-coin founders, etc.)",11/29/2013
Is there a way to create a cryptocurrency with a steady indefinite inflation rate of say 3%?,11/27/2013
The Case for Bitcoin (help me refine my argument),11/27/2013
The ‘Cryptocurrency’ Bitcoin tops $1K,11/27/2013
If you're into Bitcoin &amp; Cryptocurrency you may enjoy r/OpenSourceCoin,11/27/2013
"Just bought 1.49 PPC with a BTC referral bonus. I come from the LTC thread, but I'm excited for all cryptocurrency.",11/27/2013
Best CryptoCurrency investment?,11/27/2013
Just my input on cryptocurrency,11/27/2013
'Cryptocurrency' on the rise: Bitcoin tops $1K,11/27/2013
"[buy] Want to buy LTC in Atlanta, Georgia.",11/27/2013
These are the reasons that stop me from holding LTC,11/28/2013
What is the effect of LTC/Altcoins on BTC? Does it improve or hurt the future of digital currency?,11/28/2013
[Guide] How to start using Bitcoins,11/28/2013
[PSA] Guide on how to start using Bitcoins,11/28/2013
"Early bitcoins enthusiast, venture backed entrepreneur, where to find to altcoin devs? *2 BTC BOUNTY*",11/28/2013
The cryptowar begins and why you should pay attention,11/28/2013
Why do people often talk about banks and cryptos as enemies of each other? I think the opposite is true.,11/28/2013
Are we in the making of a Litecoin bubble? What do you think the price will peak at before falling?,11/28/2013
Could BitCoin ever adopt LiteCoin's differences?,11/28/2013
What confuses me about Litecoin,11/28/2013
With Cryptocurrency on the rise...,11/28/2013
Does cryptocurrency will fall?,11/28/2013
How difficult is it for the bitcoin infrastructure to adopt altcoins?,11/28/2013
1.1364 mBTC will now feed a homeless person,11/28/2013
To buy or to mine?,11/28/2013
╔═════════════════ ೋღ☃ღೋ ════════════════╗ ~ ~ ~ ~ ~ ~ ~ ~ ~Upvote this if ~ ~ ~ ~ ~ ~ ~ ~ ~ ~ ~ ~ ~ you are a beautiful strong cryptocurrency ~ ~ ~ ~ ~ ~ ~ ~ ~ ~ who don’t need no fiat~ ~ ~ ~ ~ ~ ~ ╚═════════════════ ೋღ☃ღೋ ════════════════╝,11/28/2013
I'm going to start mining.,11/28/2013
The Bitcoin community needs to grow up.,11/28/2013
An appeal for cryptopeace,11/28/2013
"Well boys, it's begun...Megacoin! [selfpost]",11/28/2013
The true value of bitcoin.,11/28/2013
Cryptocurrency Trading Path Finder,11/26/2013
Rise In Cryptos,11/26/2013
"UK PC Repair business and supporter of LTC for nearly a year here. I'd like to start accepting LTC here, and be able to easily explain to my massive customer base what it is. Advice please?",11/26/2013
best cryptocurrency trading firm that provides access to raw data via an API or some other method?,11/26/2013
"IAmA about to become a millionaire once Bitcoin surpases $1,000. AMA",11/26/2013
"Bitcoin Report E61 ""Cryptocurrency market cap will reach 1 trillion within next year""",11/26/2013
tired of slow cryptocurrency transactions? the answer is here.,11/26/2013
Buy now or invest in another currency?,11/26/2013
Need help undervolting my 7970,11/26/2013
Looking to get into the cryptocurrency thing but I don't really know a whole lot about it all. Can I get any info?,11/26/2013
new to bitcoin. how long does the process take to buy one?,11/26/2013
Reasons why Altcoins are not only legitimate but actually a necessity.,11/27/2013
Suggestion: Buy every new cryptocurrency out there.,11/27/2013
Adoption: Selling BTC with Creditcard/PP. Paper wallets?,11/27/2013
coinSMITHS Creative Marketplace now accepts Litecoin,11/27/2013
"Breaking News: Bitcoin surpases the $1,000 barrier",11/27/2013
"Bitcoin just broke $1000, marking a huge milestone in the continued growth of cryptocurrency",11/27/2013
My response to a Litecoin advocate,11/27/2013
A cryptocurrency for the purpose of mining some valuable information? [x-post to askscience],11/27/2013
"In Vermont, Users of ""Cryptocurrency"" Bitcoin Are Few But Committed",11/27/2013
A cryptocurrency for the purpose of mining some valuable information? [x-post to Bitcoin],11/27/2013
"In Vermont, Users of ""Cryptocurrency"" Bitcoin Are Few But Committed",11/27/2013
A cryptocurrency for the purpose of mining some valuable information?,11/27/2013
"Attention all cryptocurrency aficionados, we have a problem. Stop trading, and read this, then resume. Seriously, stop.",11/27/2013
"What makes a cryptocurrency a ""good"" cryptocurrency?",11/27/2013
Question about Armory,11/27/2013
New LTC Merchant - Selling Artwork - Originals and Prints for Litecoins - Abraham Lincoln being Assassinated At Fords Theater Made of Thousands of Words,11/27/2013
Cryptocurrency,11/27/2013
Help me win my University's Entrepreneurship Contest by Upvoting my 30 second pitch on Youtube - A CryptoCurrency Investment Firm and Trust,11/25/2013
Excited but a bit confused!,11/25/2013
Are you insane??!,11/25/2013
"Austin Bitcoin and Cryptocurrency Meetup [7:00 pm Tuesday Nov 26, Central Market on N. Lamar and 40th]",11/25/2013
"[[VENUE CHANGE:]] Austin Bitcoin and Cryptocurrency Meetup [7:00 pm Tuesday Nov 26, Scholz Garten 1607 San Jacinto Blvd]",11/25/2013
"[[VENUE CHANGE:]] Austin Bitcoin and Cryptocurrency Meetup [7:00 pm Tuesday Nov 26, Scholz Garten 1607 San Jacinto Blvd]",11/25/2013
"[[VENUE CHANGE:]] Austin Bitcoin and Cryptocurrency Meetup [7:00 pm Tuesday Nov 26, Scholz Garten 1607 San Jacinto Blvd]",11/25/2013
Austin Bitcoin Meetup [[Note: Venue Change!]],11/25/2013
Austin Bitcoin and Cryptocurrency meetup,11/25/2013
Austin Bitcoin and Cryptocurrency meetup,11/25/2013
Austin Bitcoin and Cryptocurrency meetup,11/25/2013
Made my dive into cryptocurrency with LTC today!,11/25/2013
Trade or Store almost EVERY cryptocurrency out there!!! New face for a respected site!,11/25/2013
"Dear Redit, BitCoin or LiteCoin?",11/25/2013
"I'm new to litecoin and cryptocurrency in general, please help me!",11/26/2013
Could a cryptocurrency be used to create a decentralized exchange?,11/26/2013
Please remember to do some profit taking. You can't predict the top of the bubble.,11/26/2013
Finding a cryptocurrency whose name I forgot,11/26/2013
Asteroid Asteroid 0.9.4 - Bitcoin and Litecoin cryptocurrency miner. Free public beta.,11/26/2013
Asteroid Asteroid 0.9.4 - Bitcoin and Litecoin cryptocurrency miner. Free public beta.,11/26/2013
Cryptocurrency Crunch: World Regulators To Control All Digital Currency?,11/26/2013
A prayer of thanks to the Father Satoshi in our time of blessing.,11/26/2013
How would floating point accuracy limitations affect affect a stable cryptocurrency? Do they affect trading bots?,11/26/2013
AMA Request: Someone who lost a lot during the Fontas pump,11/26/2013
[ANN] Decentralized Application Institute,11/26/2013
[For Hire] Web Design + Apps + Branding. Looking For Clients Who Care About Good Design.,11/24/2013
Cryptocurrency Relative Market Cap Chart Created in LibreOffice,11/24/2013
"Newbie wants to get in on the litecoin rush, how to I actually get some?",11/24/2013
New command available: +rates,11/24/2013
Altcoin market sites attacked?,11/24/2013
Megacoin directory,11/25/2013
Getting started question,11/25/2013
What alt coin will I be kicking myself for not investing in in 2 years?,11/25/2013
"I'm a bitcoiner, convince me to buy and hold litecoin",11/25/2013
If the way of creating bitcoins (or any other cryptocurrency) is cracking chunks of data why not cracking chunks of data in a long term project like the SETI or cancer research ? Wouldn't it be more sensible ?,11/23/2013
"Bitcoin and CryptoCurrency in Austin (Austin , TX) Weekly Meeting",11/23/2013
How Bitcoin leads to wealth decentralization and ends usury,11/24/2013
[Tech] Y-a-t-il des utilisateurs de Bitcoin à l'UTC?,11/24/2013
BOINC + Cryptocurrency,11/24/2013
Cryptocurrency + Science = Gridcoin Project,11/24/2013
Is it a problem that bitcoin suffers deflationary pressure?,11/22/2013
ATM &amp; Hardware Wallet (Bitcoins &amp; cryptocurrency) Released by Diamond Circle,11/22/2013
Help understanding the escrow function of Mastercoin user currencies?,11/22/2013
"""Why is the price rising? Here's why... (long answer)""",11/22/2013
Buying Peercoin with Paypal?,11/22/2013
[PARTNER] brain trust / research / think tank: Need researcher / technical writer obsessed with Alt/Bitcoins.,11/23/2013
Selling all my stocks to invest in BTC. Critique my BTC investment plan.,11/21/2013
Is there any insider trading regulation in Bitcoin? (example in comments),11/21/2013
Would anyone in /r/investing be interested in investing in a litecoin mining rig?,11/21/2013
Whats behind the 94% price spike?,11/21/2013
Bitcoin Cryptocurrency Crash Course with Andreas Antonopoulos,11/21/2013
Mini-farm Setup,11/21/2013
Bitcoin: The Cryptocommodity Or Cryptocurrency?,11/22/2013
Bitcoin Cryptocurrency Crash Course with Andreas Antonopoulos - Jefferson Club Dinner Meetup,11/22/2013
Thanks guys! I love this subreddit!,11/22/2013
Bticoin ATM - (cryptocurrency),11/22/2013
Is it time to add Litecoin as a payment option for gold?,11/22/2013
"For those who are familiar with Forex trading, you can now trade Cryptocurrency using Metatrader 4.",11/20/2013
[HIRING] FULL TIME ALT-COIN DEVELOPER,11/20/2013
Let's put this to rest. When is it best to mine in a large pool (&gt; 4000Mh/s); when is it best to mine in a medium one (4000 Mh/s&gt; x &gt; 1000 Mh/s); and when is it best to mine in a small one (&lt;1000 Mh/s)?,11/20/2013
"I am not an economist and this may be an ignorant question, but I am curious",11/20/2013
"Do you think litecoin will crash soon, or stay steady before rising?",11/21/2013
What I wrote about Bitcoin in 2011. I love being correct,11/21/2013
"Ulbricht denied bail, accused of commissioning six hits",11/21/2013
Opinions: How long before we see a bitcoin/cryptocurrency wallet natively integrated into iOS/Android and other platforms?,11/21/2013
My whitepaper for a new cryptocurrency SafeCoin,11/19/2013
Guide For A Complete Beginner?,11/19/2013
Buy/Selling CryptoCurrency.,11/19/2013
"I'm interested in editing the source code, where can I start?",11/19/2013
"(BTC,LTC,PPC) A couple of questions...",11/19/2013
My whitepaper for how Bitcoin needs to be improved. (X-Post from /r/CryptoCurrency/),11/19/2013
My whitepaper for a new cryptocurrency SafeCoin,11/20/2013
"""Peak Bitcoin"" Theory",11/20/2013
My whitepaper for a new crypto currency SafeCoin (X-Post from /r/CryptoCurrency/),11/20/2013
Trying to describe mining to people isn't working out for me. Help?,11/20/2013
Bitcoin as a tool of accountability for public funds spending.,11/20/2013
What The Bitcoin Bubble Really Says About The Cryptocurrency,11/20/2013
Where to go for good cryptocurrency investment advice?,11/18/2013
Best place to buy Litecoins? (UK),11/18/2013
[Mildly Trending] /r/litecoin - Litecoin: scrypt-based cryptocurrency (+213 subscribers today; 285% trend score),11/18/2013
Getting started with litecoin--concerned with safety,11/18/2013
TradeLi.st - Cryptocurrency profit/loss fee calculator,11/19/2013
Austin Bitcoin and Cryptocurrency Meetup [Tuesday Nov 19 at 7:00 pm @ Central Market on N. Lamar and 40th],11/19/2013
Austin Bitcoin and Cryptocurrency Meetup [Tuesday Nov 19 at 7:00 pm @ Central Market on N. Lamar and 40th],11/19/2013
Austin Bitcoin and Cryptocurrency Meetup [Tuesday Nov 19 at 7:00 pm @ Central Market on N. Lamar and 40th],11/19/2013
Which cryptocurrency worth buying?,11/19/2013
Anywhere to exchange cash for bitcoins in Winnipeg?,11/19/2013
Purchasing while under VPN/Proxy?,11/19/2013
just a reminder that pc gaming is dying and sucks; the only pc that is good is political correctness,11/19/2013
The Weekly Bitcoin #10 - The Price Doesn't Matter (Except That It Does),11/17/2013
[BOUNTY] 5+BTC for Protoshares (PTS) conversion of Armory Wallet,11/17/2013
Buy some of the cryptocurrency GoldCoin. It seems to be set to take off. Get a bitcoin and a few dollars of GoldCoin.,11/17/2013
Explain to me cryptocurrency,11/17/2013
Seeking feedback on my beginner guide to cryptocurrency with focus on Bitcoin and Ripple,11/18/2013
"I am a musician who released one of the earliest albums ever for cryptocurrency. AMA, and donate (but only if you like the tunes!)",11/18/2013
Help a beginner with buying/selling ltc,11/18/2013
"Head of FinCen ""Cash is still the best means of laundering money""",11/18/2013
My discussion with a major venture capital firm regarding Bitcoin in June 2011.,11/16/2013
META: Looks like we have a clear 1st place cryptocurrency winner with Bitcoin. Litecoin 2nd place. But what currency will meet financial infrastructure demands when it goes mainstream?,11/16/2013
NEW Bitcoin/Altcoin Mining Contract auctions site! Finally you can sell or buy mining contracts on 1 site legitimately! You won't be breaking rules. also has cryptocurrency exchange auctions!,11/17/2013
How to value Bitcoin,11/17/2013
"So long, /r/bitcoin, and thanks for the amazing experience!",11/17/2013
Where can I find a good Portfolio Tracker website or program.,11/15/2013
Maybe if you explained your idea a bit more?,11/16/2013
Why I personal believe Colored Coins &gt; MasterCoins,11/14/2013
Primecoin and Dark Wallet,11/15/2013
