title,Date
What is Mooncoin going to do to Dogecoin?,12/31/2013
how to back up dogecoin onto usb,12/31/2013
The real and imagined problems with Bitcoin[part1],12/31/2013
(Homeschool project)- Kids fund,12/31/2013
The Year of Bitcoin - The Incredible Rise in the Cryptocurrency,12/31/2013
The Year of Bitcoin - The Incredible Rise of the Cryptocurrency,12/31/2013
Quick question about curreny.,12/31/2013
Bitcoins Traded on Wall Street to Usher In 2014,12/31/2013
Bitcoins Traded on Wall Street to Usher In 2014,1/1/2014
Remember: What is good for Bitcoin is GREAT for DOGE! Max Keiser on BTC/Cryptocurrency,1/1/2014
[SD] 250k DOGE for liteCoin.,1/1/2014
A Question for Cryptocurrency Experts,1/1/2014
The Dogesberg Address,1/1/2014
Listen to 17 New Bitcoin Related Shows created for Let's Talk Bitcoin's Cryptocurrency Podcast Challenge – Listen and Vote for what you want more of in 2014,1/1/2014
~300 kh/s with CrossFire Sapphire HD 7850 2gb OC-edition?,12/30/2013
Any other cryptocurrency miners here?,12/30/2013
Not having a good day,12/30/2013
Making the case for Worldcoin as the next big Cryptocurrency,12/30/2013
Worth it as a small investment?,12/30/2013
"Moon Coin, assault on shibe?",12/30/2013
Bitcoin has encouraged ordinary people to join in the cryptocurrency revolution!,12/30/2013
Why is it so hard for dogecoin to be a normal cryptocurrency? This article shows why dogecoins are so awesome,12/30/2013
"[HIRING] I am developing a new cryptocurrency, but I'm not the best at graphics. I am looking for high-quality graphics for 'Boomcoin'",12/30/2013
Mining's Toll on GPU Life?,12/30/2013
I just sold my XRP via Bitstamp and picked up some NXT at Dgex.,12/30/2013
I just sold my XRP via Bitstamp and picked up some NXT at Dgex. [x-post /r/nxtcoin] submitted 571 milliseconds ago by puck2,12/30/2013
I just sold my XRP via Bitstamp and picked up some NXT at Dgex. [x-post /r/nxtcoin],12/30/2013
A Year In Bitcoin: Why We'll Still Care About The Cryptocurrency Even If It Fades,12/30/2013
Just mined my first dogecoin.,12/30/2013
Hello fellow shibes:) I am working on the terminology wiki for /r/dogeducation and need help,12/30/2013
"For Newcomers like myself, how do I get started?",12/30/2013
A Year In Bitcoin: Why We'll Still Care About The Cryptocurrency Even If It Fades,12/31/2013
"Would there be any way to design a cryptocurrency so that it could function like the mutual bank Proudhon proposed? If so, how would you do so?",12/31/2013
[serious] How do you convert too bitcoin?,12/31/2013
Such idea. To the moon!,12/31/2013
Cryptocurrency Ron Paul Coin has launched,12/31/2013
Can't find my GPU on any list :(,12/31/2013
Why I love this place:,12/31/2013
"Surprising nobody, the antags find themselves in the intersection of 4chan and cryptocurrency",12/31/2013
Zerocoin to compete directly with bitcoin? What will anoncoin do?,12/31/2013
[Build Help] R9 290 or GTX 780 for 1440P Gaming?,12/31/2013
Introducing /u/PonyTipBot! Come get your free bits while supplies last,12/31/2013
Zerocoin to compete with bitcoin? What will anoncoin do?,12/31/2013
"Twilicoin should, and can, be a real block-mined cryptocurrency. Anyone want to set it up?",12/31/2013
Just made the Dogecoin main theme,12/31/2013
"ELI5:Why is there so many dogecoins, who has all these dogecoins and how are they being mined so quickly",12/31/2013
Introducing... /u/PonyTipBot! Now works in the Plounge! Come get your free bits!,12/31/2013
HELLO? Doge is going to the moon!,12/31/2013
"Announcing CoinWhatYouWant.com - A ""Deal a Day"", ""Pay What You Want"" site for cryptocurrency enthusiasts to share their digital creations with the world.",12/31/2013
"Announcing CoinWhatYouWant.com - A ""Deal a Day"", ""Pay What You Want"" site for cryptocurrency enthusiasts to share their digital creations with the world. (X-Post r/coinwhatyouwant)",12/31/2013
"Announcing CoinWhatYouWant.com - A ""Deal a Day"", ""Pay What You Want"" site for cryptocurrency enthusiasts to share their digital creations with the world. (X-Post r/cryptocurrency)",12/31/2013
Someone Stole my DogeCoin and I have an offline wallet!!,12/31/2013
"GPU won't output video if not in the first PCI-E slot, but I need it to.",12/31/2013
[REQUEST] Starting a tipping pool for bitcoin awareness.,12/29/2013
Another fresh OC from me again. I believe Dogecoin has been really a trouble maker in cryptocurrency. To the moon!,12/29/2013
"Welcome to Good Doge, home of the good doge.",12/29/2013
A couple of wallpapers i've made,12/29/2013
Can anyone explain the whole Dogecoin thing to a complete beginner in cryptocurrency?,12/29/2013
"RANT: Musician here, just been royally ostracised by /r/litecoin. My album hit the front page of Reddit twice this year, and I've always taken Crypto-only donations. I'm just trying to educate through music, I've introduced so many people to Bitcoin this year.",12/29/2013
"When will the mining craze calm down, and prices of GPUs return to normal?",12/29/2013
"When will the mining craze calm down, and prices of GPUs return to normal?",12/29/2013
Such cryptocurrency. Many legal questions. Contribute to law review article? Wow! (xpost r/law),12/29/2013
"[MOD POST] - I've been shadowbanned, please help!",12/29/2013
Incorrectly banned!,12/29/2013
Hi-Resolution of /r/CryptoCurrency Logo,12/29/2013
I created a information thread over at /r/cryptocurrency to help draw in more interest!,12/29/2013
A Welcome Message,12/29/2013
Altcoin Weekly: a weekly newsletter on Bitcoin and altcoin such as Dogecoin. Feedback Please.,12/29/2013
Opening statement,12/29/2013
Selling doge,12/29/2013
"[US-GA] [W] Various Radeon GPUs in any condition, even broken!",12/30/2013
ASIC Mining: A risk to GPU miners?,12/30/2013
THIS LUNAR LANDING'S BEEN HIJACKED! Some bad shibes are manipulating the market.,12/30/2013
Full system - £1000 -£1200,12/30/2013
[INTRO] New to cryptocurrencies,12/30/2013
Uses for dogecoin?,12/30/2013
Money? What it this?,12/30/2013
UPDATE on DOGE: The Game,12/30/2013
UPDATE on the cryptocurrency game,12/30/2013
Tutorial: The Budget $400 Build,12/30/2013
"SaveDogemas.com: Ɖ5,000,000 raised so far, now accepting claims!",12/30/2013
How to trade and invest in Doges,12/30/2013
/u/NiceTryNSA mod of /r/NSALeaks banned while making a cryptocurrency job subreddit and game,12/30/2013
/u/NiceTryNSA mod of /r/NSALeaks banned while making a cryptocurrency job subreddit and game,12/30/2013
/u/NiceTryNSA mod of /r/NSALeaks banned while making a cryptocurrency job subreddit and game [auto-x-post - OP was 75000_Tokkul],12/30/2013
/u/NiceTryNSA mod of /r/NSALeaks banned while making a cryptocurrency job subreddit and game,12/30/2013
Lobby and Representation for CryptoCurrencies,12/30/2013
A Year In Bitcoin: Why We'll Still Care About The Cryptocurrency Even If It Fades,12/30/2013
Dogestone:Heroes of Cryptocurrency,12/30/2013
I'm pulling advertising on behalf of my clients; here's why.,12/30/2013
Looking for an in-depth guide,12/30/2013
tokens!,12/30/2013
Cryptocurrency: Dynamic Popularity Ranking,12/30/2013
"Such cryptocurrency, such fun. Come join our amazing community over at /r/dogecoin!",12/28/2013
[serious] Actively working on a sustainable future for Doge,12/28/2013
"Shibes, let's have a talk about design.",12/28/2013
DOGECOIN WILL SUCCEED!,12/28/2013
DOGE's GIRLS: few but the best! :),12/28/2013
Have a unique CryptoCurrency in mind.. how can I make it real?,12/28/2013
doge-mall.tk our newly launched crypto trading/buying site is up and ready to go!,12/28/2013
Megacoin - Kim Dotcom's New Cryptocurrency,12/28/2013
Bitcoin Retro Arena,12/28/2013
[META] Subreddit Discussion and Feedback Thread,12/28/2013
New to dogecoin. This all seems pretty awesome. I have a few quick questions(Sorry cryptocurrency noob).,12/28/2013
This video could even double as a psa for cryptocurrency,12/29/2013
Introducing The CryptoNetwork,12/29/2013
The new face of Cryptocurrency. GRUMPY CAT - Catcoin,12/29/2013
[BEG] New to cryptocurrency,12/29/2013
Ðogecoin - Shibes are a month in on their cryptocurrency and its looking to be a huge successes!,12/29/2013
I have some questions re mining and rewards thereof.,12/29/2013
Breaking the Learning Curve,12/29/2013
[META] Feel free to offer cryptocurrencies other than BTC!,12/29/2013
Introducing /r/CryptoJobs: Earn Cryptocurrency on Reddit,12/29/2013
Introducing /r/CryptoJobs: Earn Cryptocurrency on Reddit,12/29/2013
Introducing /r/CryptoJobs: Earn Cryptocurrency on Reddit,12/29/2013
Introducing /r/CryptoJobs: Earn Cryptocurrency on Reddit,12/29/2013
Introducing /r/CryptoJobs: Earn Cryptocurrency on Reddit,12/29/2013
Introducing /r/CryptoJobs: Earn Cryptocurrency on Reddit,12/29/2013
Faster wallet sync with the doge network?,12/29/2013
CryptoJobs: Earn Cryptocurrency on Reddit,12/29/2013
New Litecoin Forum,12/29/2013
"Old Doge, new tricks. much thanks.",12/29/2013
Introducing /r/CryptoJobs: Earn Cryptocurrency on Reddit,12/29/2013
Anybody want an Anti-NSA/GOV shutdown Cryptocurrency Exchange using BitTorrent Sync?,12/29/2013
"Thanks for getting me interested, /r/dogecoin!",12/27/2013
"I run Quain Percussion, a small cajon drum shop. I'm now accepting Bitcoins as payment! Prices start at .2204 BTC!",12/27/2013
I've been having the hardest time trying to set up mining? Could someone please help me out?,12/27/2013
"One day, history will look back on Dogecoin as the source of cryptocurrency success.",12/27/2013
"[WTS] Cajon Drums, starting at .2204 BTC. I run Quain Percussion, a small cajon drum shop. I'm now accepting Bitcoins (and Dogecoins) as payment!",12/27/2013
Just found the best website ever; a must for cryptocurrency users!,12/27/2013
Just found the best website ever; a must for cryptocurrency users!,12/27/2013
Just found the best website ever; a must for cryptocurrency users!,12/27/2013
Is cryptocurrency gambling illegal?,12/27/2013
Datacoin is the most useful coin of all right now!,12/27/2013
[WTS] $50 Steam Gift Card (can gift if needed),12/27/2013
"A few questions for the serious shibes: How, when, and why will Dogecoin rise in value?",12/27/2013
"I've got a little MicroBitcoin, an itty bitty bit of Litecoin... But now I officially have my first Dogecoin! SUCH EXCITE.",12/27/2013
Just want to say hello,12/27/2013
How do I explaine doge coin or any cryptocurrency to my Mexican parents who barely even know how to use google.,12/27/2013
Much Confused. Wow. So New. Much Mine,12/27/2013
"My LTC wishes for 2014 : MtGox, ZipZap, Coinbase, Coinkite, Bitcoiniacs, Coinkite, Lamassu ATMs and so much more...",12/27/2013
[Maryland]running a sportsbook,12/27/2013
I never thought this would happen...,12/27/2013
Vorksholk's Miner Building Service,12/27/2013
"December 28th 2013 - /r/dogecoin: very currency, many transactions, such riches, wow!",12/27/2013
"A traffic and engagement analysis of dogecoin. From a marketing standpoint, dogecoin is a slam dunk.",12/27/2013
Exhaustive analysis on the dogecoin cryptocurrency from a former economist phD.,12/27/2013
New to Ðogecoin?,12/28/2013
The only way to make Peercoin the main cryptocurrency,12/28/2013
Doge - an unbiased economical examination of the future and what can be done to enhance growth.,12/28/2013
(Serious) Maturity and Image,12/28/2013
How can I protect my doges?,12/28/2013
Need some help getting my website to accept Dogecoins.,12/28/2013
A few newbie questions,12/28/2013
Been mining for over a week and I can't stop,12/28/2013
Free $50 Bitcoin Advertising Credit = FREE ads! DO YOUR PART AND SPREAD IT AS WELL!,12/28/2013
Dogecoin Community - Wow,12/28/2013
New to dogecoin,12/28/2013
To all the Shibes out there currently concerned about the price fluctuations/volatility of Ðogecoin,12/28/2013
Lost Dogecoins: Cryptocurrency goes missing | Crave,12/28/2013
We Need A Tip Team,12/28/2013
Why Dogecoin IS a smart investment,12/28/2013
"If r/DogeCoin Reaches 25,000 Subscribers by 3:00pm EST on New Years Day 2014, I will Give Away 500,000 Dogecoins to Posters in this Thread",12/28/2013
"since cryptocurrency mining, the only time my GPU gets a break is when i play graphically intensive games.",12/28/2013
Buying Art with DOGECOIN!,12/28/2013
What should I get?,12/28/2013
"Fastly moving cryptocurrency through exchanges- My question: Which exchanges process transactions fastest, and which currencies are the quickest to transfer?",12/26/2013
[Hiring] CoinTerra seeks Technical Support Specialist to join our team! (x-post /r/AustinJobs),12/26/2013
Hash Cloudy (Bitcoin &amp; Litecoin Mining Service),12/26/2013
Is anyone implementing Cryptocurrency use in their games?,12/26/2013
Dogecoin - the new Cryptocurrency headed straight to the moon!,12/26/2013
"Dogecoin (DOGE), a new cryptocurrency is on the rise. Come join us at r/Dogecoin and learn how to get started! Wow, such crypto, much fun",12/26/2013
I have just lost all my Christmas Money (converted to 240k dogecoin) on a Doge Gambling Roulette Website. I feel like death.,12/26/2013
Offering my web dev services.,12/26/2013
Miami's first restaurant to accept bitcoin! Tomorrow will be their first bitcoin happy hour - please come if you're in the area (upvote for visibility),12/26/2013
Dogecommunity Website Services - Free to Cheap - Let's Go to the Moon in Style,12/26/2013
Dogecommunity Website Services - Free to Cheap - Let's Go to the Moon in Style,12/26/2013
[WTS] TIPs for BTC or DOGE,12/26/2013
"Disspelling the ""pre-mining myth"" of NXT",12/26/2013
Diamond R9 280X Boost overheating problem,12/26/2013
Diamond R9 280X Boost overheating problem,12/26/2013
New to Cryptocurrency? Please read this from the following Crypto Community (xpost from /r/dogecoin Original OP /u/BillyM2k),12/26/2013
"OK, I'm hooked.",12/26/2013
Market flooding?,12/26/2013
welcome to the virgilbucks subreddit,12/26/2013
We need a KittehTipBot,12/26/2013
A vital part of dogecoin!,12/26/2013
[BEG] Milkbones please.,12/27/2013
"A reddit-like site, where karma is cryptocurrency.",12/27/2013
"X - POST - Alpha Technology, Scrypt ASIC, and protecting the Cryptocurrency Ecosystem - Help us help each other.",12/27/2013
New to all of this but I love it! Can someone explain an online wallet,12/27/2013
Digging slowly to the moon and I am loving it!,12/27/2013
"[WTS] 150k Dogecoins @ $0.75/k for trades over 10k, $0.80 all other trades!",12/27/2013
You are the Reason Why Dogecoin will absolutely go to the Moon!,12/27/2013
[ANN] Looking for any kind of assistance to get the Litecoin newbies on their way!!!,12/27/2013
Herd Digging is awesome but...,12/27/2013
This is A Call to Action: Let's get Dogecoin accepted everywhere! Details inside.,12/27/2013
Idea for spreading the wealth and increasing interest in dogecoin,12/27/2013
[FORHIRE] CryptoCurrency Developers,12/27/2013
Android Wallet?,12/27/2013
"If you haven't already checked it out, I believe that EarnCrypto has surpassed Getbitcoin as the best way to earn some easy BTC, you can even redeem for Dogecoin or other currencies if you prefer!",12/27/2013
[HIRING] Cryptocurrency developers (for product dev),12/27/2013
Setting up old pcs as servers,12/27/2013
[WTS] Merrell J15277 Sonic Glove (black gradient) shoes,12/27/2013
Lost Dogecoins: Cryptocurrency goes missing,12/27/2013
"""Bitcoin is the one true cryptocurrency, burn the heretic!'",12/27/2013
Any chance possibility of creating an AltCoin that could have built in two-factor authentication for sending coins?,12/25/2013
We should promote Dogecoin as the goto cryptocurrency for the purchasing of dogs!,12/25/2013
Got a few questions about Bottlenecking a R9 270 with an i3 530,12/25/2013
"[BEG] - New to dogecoin, wallet empty like my bag of happiness, please halp noobie out",12/25/2013
How to appear more appealing to employers.,12/25/2013
"[H] Sprint Galaxy Note 2 [W] other Sprint phones, paypal, cryptocurrency",12/25/2013
Another newbie here !,12/25/2013
So New... Much Confuse,12/25/2013
CryptoCurrency ruined my Christmas :'(,12/25/2013
Slovenia Clarifies Position on Cryptocurrency Tax,12/25/2013
[PSA] Explaining Dogecoin in 42 Words,12/25/2013
How to Explain Dogecoin in 42 Words,12/25/2013
Vote: Should GoldCoin and StableCoin be listed because of pre-mining history?,12/26/2013
Is Dogecoin worth mining with a nvidia card?,12/26/2013
Idea for a new type of cryptocurrency.,12/26/2013
Chococoin: A cryptocurrency designed to sell Chocolate.,12/26/2013
"Pat yourselves on the back, fellow shibes; our community is one of the strongest.",12/26/2013
"[BEG] Hello, yes this is doge",12/26/2013
Comprehension Question concerning cloud mining &amp; co.,12/26/2013
[BEG] How my dogecoins dissapeared...,12/26/2013
I need help buying peercoins.,12/26/2013
"Support a great charity (Alex's Lemonade Stand- Pediatric Cancer) with cryptocoins, and get entered in a raffle also. Details inside.",12/26/2013
is Tagcoin Vulnerable for 51% attack?,12/26/2013
A quick look at Peercoin's Security,12/26/2013
Beyond bitcoin: Inside the cryptocurrency ecosystem,12/26/2013
"Support a great charity (Alex's Lemonade Stand- Pediatric Cancer) with crypto-coins, and get entered in a raffle also. Details inside.",12/26/2013
CoinLottery looking for initial testers,12/26/2013
"Should We Stop Using The Word ""Crypto""?",12/26/2013
Mining questions from a newbie shibe,12/26/2013
What is Dogecoin?,12/26/2013
Introducing the newest cryptocurrency: le trolecoin. Upvote this post to claim 1 TRC,12/26/2013
I want to invest in coin using paypal. Can anyone recommend a good source?,12/26/2013
[Build Help] My friend just won 8000 (post-tax) on a scratcher and wants to build a beastly gaming PC.,12/26/2013
[Hiring] Technical Support Specialist for Bitcoin ASIC Semi-Conductor Company,12/26/2013
[Build Help] Videocards for mining,12/26/2013
"Do you diversify your cryptocurrency holdings? If so, what other coins do you think are worth exploring, and why?",12/26/2013
Working on a DOGECOIN only exchange,12/24/2013
[WTB] $5-$10 incrementally via Paypal,12/24/2013
"The Real Problem with Bitcoin is one of its ""Benefits.""",12/24/2013
[meta] Dogecoin dev / co-founder here. Litecoin is the reason I stayed interested in cryptocurrency (warning: long and rambly) : litecoin,12/24/2013
Now accepting Bitcoin and Peercoin for my permaculture services,12/24/2013
Such cryptocurrency. Many legal questions. Help write a law review article? Wow!,12/24/2013
"New to altcoins, care to help?",12/24/2013
"Alpha Technology, Scrypt ASICS, and protecting the Cryptocurrency ecosystem - Help us help each other",12/24/2013
"Rugatu Guide (Rules, asking and answering)",12/24/2013
Only 470 away!,12/24/2013
"X - POST - Alpha Technology, Scrypt ASICs, and protecting the Cryptocurrency ecosystem - You can help.",12/25/2013
"X- POST - Alpha Technology, Scrypt ASICs, and protecting the Cryptocurrency ecosystem - Help us help each other.",12/25/2013
Taking Dogecoin to the moon and beyond; one small step for shibe; one giant leap for shibekind.,12/25/2013
How Ron Paul eventually owned Paul Krugman (Bitcoin/gold standard),12/25/2013
I'm thinking about signing up for flat-rate bill with my power company and mining some cryptocurrency on their dollar. Any suggestions?,12/25/2013
Why are people willing to sell dogecoins over Paypal but not bitcoins?,12/25/2013
Animators and Cartoonists now supporting Quark! Merry Christmas!,12/25/2013
I hot 14k this morning! Merry dogemas!,12/25/2013
[ANN] Lightweight Android application for Litecoin/Cryptocurrency pricing (WIP),12/25/2013
Datacoin - Cryptocurrency based on primecoin,12/25/2013
CryptoWisdom.com to be up and running on 1/1/14,12/25/2013
Almost all my Dogecoin doge-gone. Was I hacked?,12/25/2013
"In response to Paul Krugman calling Bitcoin mining ""socially wasteful""",12/25/2013
"Dogecoin ""Notable"" Cryptocurrency",12/25/2013
A thought on protecting DogeCoin from hacks and scams,12/25/2013
[WTS] DOGE for competitive prices ($0.70/1kDOGE) - Over 200k DOGE in stock. Reputation thread link in post,12/23/2013
Emergency Fatal Threat Reactionary Plan,12/23/2013
Wow. So intriguing. much wait. very amazed!,12/23/2013
How hard is mining on your computer?,12/23/2013
Everything about Dogecoins: The new cryptocurrency that will take investors to the moon!,12/23/2013
"I've created a Dogecoin multireddit, feel free to subscribe/pass it around.",12/23/2013
Bitcoin's popularity growth is outpacing the general public's understanding. We're making a website to educate the world on cryptocurrency.,12/23/2013
[BEG] I think I don't like doge. Help me to find my belief!,12/23/2013
WTB Much Doge! So Wow PP verified!,12/23/2013
Is the economic slump a huge reason why Bitcoin is popular with the younger geneartions?,12/23/2013
I'm having trouble buying on Cryptsy?,12/23/2013
In need of programmers for a new CryptoCurrency striving to be truly unique. For more info join #CryptoCredits on Rizon,12/23/2013
Dogecoin dev / co-founder here. Litecoin is the reason I stayed interested in cryptocurrency (warning: long and rambly),12/23/2013
Bitcoin is truly a revolution. It is about the other 6.5 billion people on this planet. Forget about the price.,12/23/2013
Help me revive galaxycoin,12/23/2013
What do you want to see in a new cryptocurrency?,12/23/2013
How to give Dogecoin for the holidays - Newbie's guide,12/23/2013
/r/DogeCoin... growing cryptocurrency,12/23/2013
/r/DogeCoin... growing cryptocurrency,12/23/2013
"Disaster Planning - Exhaustive list of things that *could* kill Bitcoin, and what to do if they happen",12/23/2013
Will CryptoCurrency Mining Continue to be Popular in 2014?,12/23/2013
Trying to learn more about cryptocurrency. Can you help? Hoping to trade a small amount of Doge (600) for a small amount of Bitcoin.,12/23/2013
Dogecoin is the perfect mix of cryptocurrency and memes,12/23/2013
Want to make a profit during a gold rush? Sell eggs.,12/23/2013
To all the Dogecoin scammers out there,12/23/2013
"Much hopeless in dodgy altcoins, even at xmas. Everyone so make their own wow cryptocurrency",12/23/2013
Cryptowriting: the perfect mix of cryptocurrency and robots (WIP),12/23/2013
Are bitcoins too traceable?,12/23/2013
Ðogecoin just passed feathercoin on coinmarketcap and is now in the top 10 of cryptocurrency value. To the moon!,12/24/2013
Ðogecoin just passed feathercoin on coinmarketcap and is now in the top 10 of cryptocurrency value. To the moon!,12/24/2013
Assuming Cryptocurrency Trumps all…,12/24/2013
What is a cryptocurrency?,12/24/2013
"Auction for 2,000 Dogecoins on eBay",12/24/2013
It's so unfair: the rich get richer...,12/24/2013
New to Cryptocurrency miner seems to be working but no doges...?,12/24/2013
Quarkcoin's supporters' logics,12/24/2013
Which hashrate should I be reading?,12/24/2013
One way to the moon,12/24/2013
Homeschool- me and my daughter are on a quest. Build the biggest p2p exchange.,12/24/2013
"I just bought some DOGE on ebay and after paying for them, a couple of hours later, the seller refunded my money and re-listed them for a much higher price.",12/24/2013
The invention of Bitcoin is truly a revolution. This is about the other 6.5 billion people on this planet. Forget about the price.,12/24/2013
"Beyond Bitcoin: The Cryptocurrency Ecosystem @Fortune Magazine (I'm the author, tell me what I got wrong!)",12/24/2013
[WTT] FedoraCoin (New cryptocurrency) for Dogecoin,12/24/2013
http://imgur.com/ChhkMr4,12/24/2013
My Dogecoin Experience,12/24/2013
[BEG] I want to bury myself in the cryptomarket over this Christmas,12/24/2013
All I want for Christmas is to go to the moon,12/24/2013
"New to Cryptocurrency? Please read this, my advice from following the crypto community.",12/24/2013
Cryptocurrency author replied to my dogecoin comment!,12/24/2013
Just saying Thanks!,12/24/2013
[Guide] How to Give Dogecoin for the Holidays,12/24/2013
why is mining so hard?,12/24/2013
Curious how many people currently have GPU mining rigs and if so which cryptocurrency are you mining / what resources do you use as reason to why you selected that certain currency?,12/24/2013
"Hey r/Bitcoin - we're thrilled to be (and actually prefer it to Fiat) accepting BTC on our website.. if you'd like some info on what we do / who we are, read on :)",12/22/2013
China rejects Bitcoin in favour of new cryptocurrency,12/22/2013
[WTS] 94 civic auction coming to a close. Updated status / Results,12/22/2013
"Why Dogecoin is going to $1... and beyond. Please keep the shibe people. I have a knack for calling the next big thing, and I feel that Dogecoin may just be it!",12/22/2013
A Bitcoin Adventure.,12/22/2013
"[INTRO] I am Silver_Foxx, and I AM CANADIAN, eh?",12/22/2013
"Wow, much noob, such curiosity.",12/22/2013
[WTS] Steam Games?,12/22/2013
Nobody wants cash for CryptoCurrency?!?!,12/22/2013
Bitcoin alternative.,12/22/2013
"Lot fun, here noob!",12/22/2013
Best value of Dogecoin..,12/22/2013
such problem much help,12/22/2013
[BEG] I'm gonna give my friend a doge wallet in a little secret santa thing to get her started with cryptocurrency. Halp?,12/22/2013
Would having multiple wallets be a good idea?,12/22/2013
Albertee | Cryptocurrency for Everyone | Bitcoin News Site,12/22/2013
What could be a cheap rig that I could buy multiple of for mining?,12/22/2013
CryptoMiners (CONCEPT),12/22/2013
I'm having a blast (to the moon?) mining Dogecoin!,12/22/2013
"""Legalese"" Surrounding PayWithMyBank",12/22/2013
"[BEG] Made a song for Dogecoin, but they ignored it. Maybe you'll appreciate it?",12/22/2013
So with few days to go until Xmas I had no idea what to get my Siblings.,12/22/2013
How Dogecoin changed my perspective on cryptocurrency,12/22/2013
Withdraw dogecoins from address?,12/23/2013
"Someone should make a cryptocurrency for this community, Clopcoin?",12/23/2013
"I didn't know what DogeCoin was on Saturday morning, but by Sunday night I mined around 400 DogeCoins",12/23/2013
cryptocurrency exchange. is there a way to set one up?,12/23/2013
"Idea for a fun ""currency"" that essentially plays like a game.",12/23/2013
Newbie question: could cloud-encryption be a good way to store Bitcoins in the future?,12/23/2013
